key,news,img,link,date_str,date_parsed
0,Fireblocks acquires crypto payments processor First DAG in cash-and-stock deal,https://www.tbstat.com/wp/uploads/2020/03/fireblocks-800x450.jpg,https://coinmarketcal.com/en/news/fireblocks-acquires-crypto-payments-processor-first-dag-in-cash-and-stock-deal,16-Feb-22,2/16/2022 0:00
1,Crypto copy-trading protocol Housecat emerges from stealth with $3.5 million in funding,https://www.tbstat.com/wp/uploads/2022/02/20220208_Housecat-800x450.jpg,https://coinmarketcal.com/en/news/crypto-copy-trading-protocol-housecat-emerges-from-stealth-with-3-5-million-in-funding,16-Feb-22,2/16/2022 0:00
2,UK neobank Atom raises more than $100 million as it eyes an IPO,https://www.tbstat.com/wp/uploads/2022/01/20220117_Funding_Increase_Numbers-800x450.jpg,https://coinmarketcal.com/en/news/uk-neobank-atom-raises-more-than-100-million-as-it-eyes-an-ipo,16-Feb-22,2/16/2022 0:00
3,PayPal to limit some NFT transactions for its merchant-focused Seller Protection program,https://www.tbstat.com/wp/uploads/2021/08/paypal-675x450.jpeg,https://coinmarketcal.com/en/news/paypal-to-limit-some-nft-transactions-for-its-merchant-focused-seller-protection-program,15-Feb-22,2/15/2022 0:00
4,Ethereum wallet Rainbow raises $18 million from Reddit co-founder’s VC fund,https://www.tbstat.com/wp/uploads/2021/12/210921_Funding_Money_General-800x450.jpg,https://coinmarketcal.com/en/news/ethereum-wallet-rainbow-raises-18-million-from-reddit-co-founders-vc-fund,15-Feb-22,2/15/2022 0:00
5,Ethereum wallet Rainbow raises $18 million in round led by Reddit co-founder’s VC fund,https://www.tbstat.com/wp/uploads/2021/12/210921_Funding_Money_General-800x450.jpg,https://coinmarketcal.com/en/news/ethereum-wallet-rainbow-raises-18-million-in-round-led-by-reddit-co-founders-vc-fund,15-Feb-22,2/15/2022 0:00
6,"Why Larry David was the perfect ‘anti-sponsor’ of FTX’s Super Bowl ad, according to Jeff Schaffer",https://www.tbstat.com/wp/uploads/2022/02/shutterstock_52374184-675x450.jpg,https://coinmarketcal.com/en/news/why-larry-david-was-the-perfect-anti-sponsor-of-ftxs-super-bowl-ad-according-to-jeff-schaffer,15-Feb-22,2/15/2022 0:00
7,Treasury official touts the ‘flexibility’ of bank charters for stablecoin issuers during Senate hearing,https://www.tbstat.com/wp/uploads/2019/04/U.S._Treasury_Building_and_Albert_Gallatin_Statue-600x450.jpg,https://coinmarketcal.com/en/news/treasury-official-touts-the-flexibility-of-bank-charters-for-stablecoin-issuers-during-senate-hearing,15-Feb-22,2/15/2022 0:00
8,Tokemak: liquidity rental-as-a-service,https://www.tbstat.com/wp/uploads/2022/02/220209_Tokemak_Liquidity_Bootstrapping-Research-800x450.jpg,https://coinmarketcal.com/en/news/tokemak-liquidity-rental-as-a-service,15-Feb-22,2/15/2022 0:00
9,NYSE trademark application spotlights marketplace for NFTs,https://www.tbstat.com/wp/uploads/2019/02/nyse-800x450.jpg,https://coinmarketcal.com/en/news/nyse-trademark-application-spotlights-marketplace-for-nfts,15-Feb-22,2/15/2022 0:00
10,JPMorgan stakes a claim in the metaverse with Decentraland lounge,https://www.tbstat.com/wp/uploads/2022/02/Screen-Shot-2022-02-15-at-12.07.44-PM-451x450.png,https://coinmarketcal.com/en/news/jpmorgan-stakes-a-claim-in-the-metaverse-with-decentraland-lounge,15-Feb-22,2/15/2022 0:00
11,Congressman Warren Davidson introduces bill to protect self-hosting of cryptocurrencies,https://www.tbstat.com/wp/uploads/2018/12/lawyer-sign-book-800x450.jpg,https://coinmarketcal.com/en/news/congressman-warren-davidson-introduces-bill-to-protect-self-hosting-of-cryptocurrencies,15-Feb-22,2/15/2022 0:00
12,A DAO that funds students to attend crypto events loses half its budget to risky management,https://www.tbstat.com/wp/uploads/2022/02/Webp.net-resizeimage21-800x450.jpg,https://coinmarketcal.com/en/news/a-dao-that-funds-students-to-attend-crypto-events-loses-half-its-budget-to-risky-management,15-Feb-22,2/15/2022 0:00
13,A DAO that funds students to attend crypto events loses half its future events budget to risky management,https://www.tbstat.com/wp/uploads/2022/02/Webp.net-resizeimage21-800x450.jpg,https://coinmarketcal.com/en/news/a-dao-that-funds-students-to-attend-crypto-events-loses-half-its-future-events-budget-to-risky-management,15-Feb-22,2/15/2022 0:00
14,"Safe Foundation, proposed steward of the Gnosis Safe ecosystem, plans to raise $100 million",https://www.tbstat.com/wp/uploads/2020/09/20200902_Gnosis_Tender_Offer-Daily-800x450.jpg,https://coinmarketcal.com/en/news/safe-foundation-proposed-steward-of-the-gnosis-safe-ecosystem-plans-to-raise-100-million,15-Feb-22,2/15/2022 0:00
15,US lawmaker debuts draft of federal stablecoin regulation bill,https://www.tbstat.com/wp/uploads/2020/12/20201203_Stablecoin_Congress-Daily-800x450.png,https://coinmarketcal.com/en/news/us-lawmaker-debuts-draft-of-federal-stablecoin-regulation-bill,15-Feb-22,2/15/2022 0:00
16,Judge rules in favour of Bitstamp owner after courtroom clash with founder,https://www.tbstat.com/wp/uploads/2019/05/gavel-1-800x450.jpg,https://coinmarketcal.com/en/news/judge-rules-in-favour-of-bitstamp-owner-after-courtroom-clash-with-founder,15-Feb-22,2/15/2022 0:00
17,Vesta Equity launches real estate-backed NFT platform on Algorand,https://www.tbstat.com/wp/uploads/2019/06/houses-800x450.jpg,https://coinmarketcal.com/en/news/vesta-equity-launches-real-estate-backed-nft-platform-on-algorand,15-Feb-22,2/15/2022 0:00
18,"Binance removes its name from its blockchain ecosystem, now called BNB Chain",https://www.tbstat.com/wp/uploads/2021/12/2021_Changpeng-Zhao-CZ-Binance-800x450.jpg,https://coinmarketcal.com/en/news/binance-removes-its-name-from-its-blockchain-ecosystem-now-called-bnb-chain,15-Feb-22,2/15/2022 0:00
19,Solana NFT data site Solanalysis rebrands to Hyperspace and raises $4.5 million,https://www.tbstat.com/wp/uploads/2022/02/shutterstock_1856940589-800x450.jpg,https://coinmarketcal.com/en/news/solana-nft-data-site-solanalysis-rebrands-to-hyperspace-and-raises-4-5-million,15-Feb-22,2/15/2022 0:00
20,YouTube is hiring for director to lead Web3 push,https://www.tbstat.com/wp/uploads/2022/01/Webp.net-resizeimage17-800x450.jpg,https://coinmarketcal.com/en/news/youtube-is-hiring-for-director-to-lead-web3-push,15-Feb-22,2/15/2022 0:00
21,Highest-ever CryptoPunk sale nets $24 million,https://www.tbstat.com/wp/uploads/2022/02/CryptoPunk-5822.png,https://coinmarketcal.com/en/news/highest-ever-cryptopunk-sale-nets-24-million,14-Feb-22,2/14/2022 0:00
22,"Build Finance DAO suffers ‘hostile governance takeover,’ loses $470,000",https://www.tbstat.com/wp/uploads/2022/02/buildfinance-800x440.png,https://coinmarketcal.com/en/news/build-finance-dao-suffers-hostile-governance-takeover-loses-470-000,14-Feb-22,2/14/2022 0:00
23,Avi Felman explains how he decides to make massive bitcoin trades,https://www.tbstat.com/wp/uploads/2022/02/20220214_TheScoop_Avi-Felman-16x9-1-800x450.png,https://coinmarketcal.com/en/news/avi-felman-explains-how-he-decides-to-make-massive-bitcoin-trades,14-Feb-22,2/14/2022 0:00
24,Radicle: Towards decentralized code collaboration,https://www.tbstat.com/wp/uploads/2022/02/220203_Radicle_Research-800x450.jpg,https://coinmarketcal.com/en/news/radicle-towards-decentralized-code-collaboration,14-Feb-22,2/14/2022 0:00
25,"With $100 million settlement confirmed, BlockFi aims to register Yield with SEC",https://www.tbstat.com/wp/uploads/2021/03/20210305_Blockfi-800x450.png,https://coinmarketcal.com/en/news/with-100-million-settlement-confirmed-blockfi-aims-to-register-yield-with-sec,14-Feb-22,2/14/2022 0:00
26,Concerns grow over Monero mining pool that has 44% of the network’s hash rate,https://www.tbstat.com/wp/uploads/2019/12/shutterstock_1405304669-675x450.jpg,https://coinmarketcal.com/en/news/concerns-grow-over-monero-mining-pool-that-has-44-of-the-networks-hash-rate,14-Feb-22,2/14/2022 0:00
27,Crypto apps soar in popularity after Super Bowl splurge,https://www.tbstat.com/wp/uploads/2021/04/20210416_Coinbase_Generic_Stocks-800x450.jpg,https://coinmarketcal.com/en/news/crypto-apps-soar-in-popularity-after-super-bowl-splurge,14-Feb-22,2/14/2022 0:00
28,UK taxman siezes first NFTs in £1.4 million fraud probe,https://www.tbstat.com/wp/uploads/2022/01/220113_NFT_Generic-800x450.jpg,https://coinmarketcal.com/en/news/uk-taxman-siezes-first-nfts-in-ps1-4-million-fraud-probe,14-Feb-22,2/14/2022 0:00
29,PotionLabs Closes Sales of $12M from key DeFi players ahead of Novel NFT Game 'Potion Unlock',https://d32bfp67k1q0s7.cloudfront.net/c45d98d04e63a32bc78586080e3ccfe0.png,https://coinmarketcal.com/en/news/potionlabs-closes-sales-of-12m-from-key-defi-players-ahead-of-novel-nft-game-potion-unlock,14-Feb-22,2/14/2022 0:00
30,"Coinbase, FTX make Super Bowl debut, commit to giving away crypto",https://www.tbstat.com/wp/uploads/2022/02/Webp.net-resizeimage19-800x450.jpg,https://coinmarketcal.com/en/news/coinbase-ftx-make-super-bowl-debut-commit-to-giving-away-crypto,14-Feb-22,2/14/2022 0:00
31,The top 4 cryptocurrencies that pay dividends in 2022,https://coinmarketcal.com/images/coinmarketcal-placeholder.jpg,https://coinmarketcal.com/en/news/the-top-4-cryptocurrencies-that-pay-dividends-in-2022,14-Feb-22,2/14/2022 0:00
32,Libertex's crypto CFD trading - an interesting alternative while you HODL,https://i.ibb.co/Z1jHPdS/photo-2022-02-14-14-22-48.jpg,https://coinmarketcal.com/en/news/libertexs-crypto-cfd-trading-an-interesting-alternative-while-you-hodl,14-Feb-22,2/14/2022 0:00
33,How NFTs are raising money for charity,https://www.tbstat.com/wp/uploads/2022/02/220202_NFT_Raising_Money_Charity_2-800x450.jpg,https://coinmarketcal.com/en/news/how-nfts-are-raising-money-for-charity,12-Feb-22,2/12/2022 0:00
34,BlockFi faces $100 million in penalties over crypto interest accounts: report,https://www.tbstat.com/wp/uploads/2021/11/211029_SEC_General4-800x450.jpg,https://coinmarketcal.com/en/news/blockfi-faces-100-million-in-penalties-over-crypto-interest-accounts-report,12-Feb-22,2/12/2022 0:00
35,Supremacy offers a sustainable edge to play-to-earn economy,https://d32bfp67k1q0s7.cloudfront.net/99e8f3e7eaf8b42bd28db32cee952d12.png,https://coinmarketcal.com/en/news/supremacy-offers-a-sustainable-edge-to-play-to-earn-economy,12-Feb-22,2/12/2022 0:00
36,Deciphering the Metaverse: The display of modern tribalism,https://www.tbstat.com/wp/uploads/2021/11/211112_Deciphering_the_Metaverse_Research9-800x450.jpg,https://coinmarketcal.com/en/news/deciphering-the-metaverse-the-display-of-modern-tribalism,11-Feb-22,2/11/2022 0:00
37,"US Treasury reiterates that the IRS won’t consider crypto miners, stakers or coders to be brokers",https://www.tbstat.com/wp/uploads/2020/03/IRS-600x450.jpg,https://coinmarketcal.com/en/news/us-treasury-reiterates-that-the-irs-wont-consider-crypto-miners-stakers-or-coders-to-be-brokers,11-Feb-22,2/11/2022 0:00
38,Jamaica is on track to roll out a digital currency in 2022,https://www.tbstat.com/wp/uploads/2020/04/20200421-Central-Bank-Daily-800x450.jpg,https://coinmarketcal.com/en/news/jamaica-is-on-track-to-roll-out-a-digital-currency-in-2022,11-Feb-22,2/11/2022 0:00
39,World Wildlife Fund pulls conservation-focused NFT project after backlash,https://www.tbstat.com/wp/uploads/2021/05/20210513_NFT_Generic_P-800x450.jpg,https://coinmarketcal.com/en/news/world-wildlife-fund-pulls-conservation-focused-nft-project-after-backlash,11-Feb-22,2/11/2022 0:00
40,Rollup to Rollup Bridges: Connecting Layer 2s,https://www.tbstat.com/wp/uploads/2022/02/20220208_Rollup_Rollup_Bridges-Research-800x450.jpg,https://coinmarketcal.com/en/news/rollup-to-rollup-bridges-connecting-layer-2s,11-Feb-22,2/11/2022 0:00
41,"Dr. Oz files trademarks for kitchen appliances, diet classes and other digital goods and services in the metaverse",https://www.tbstat.com/wp/uploads/2022/02/20220207-Generic-NFT-800x450.jpg,https://coinmarketcal.com/en/news/dr-oz-files-trademarks-for-kitchen-appliances-diet-classes-and-other-digital-goods-and-services-in-the-metaverse,11-Feb-22,2/11/2022 0:00
42,"Uber CEO says rideshare company will accept crypto ‘at some point,’ cites transaction costs and environmental concerns",https://www.tbstat.com/wp/uploads/2019/07/uber-1-800x450.jpg,https://coinmarketcal.com/en/news/uber-ceo-says-rideshare-company-will-accept-crypto-at-some-point-cites-transaction-costs-and-environmental-concerns,11-Feb-22,2/11/2022 0:00
43,"OpenSea launches venture arm, NFT ecosystem grant program",https://www.tbstat.com/wp/uploads/2021/09/20210915_OpenSea-800x450.jpg,https://coinmarketcal.com/en/news/opensea-launches-venture-arm-nft-ecosystem-grant-program,11-Feb-22,2/11/2022 0:00
44,"Airdrop for Ethereum, Cosmos power users set to take place next week",https://www.tbstat.com/wp/uploads/2021/10/20211011_Airdrop_Request-800x450.jpg,https://coinmarketcal.com/en/news/airdrop-for-ethereum-cosmos-power-users-set-to-take-place-next-week,11-Feb-22,2/11/2022 0:00
45,One River teams up with Coinbase to offer crypto accounts for investment advisors,https://www.tbstat.com/wp/uploads/2019/07/money-stacks-800x450.jpg,https://coinmarketcal.com/en/news/one-river-teams-up-with-coinbase-to-offer-crypto-accounts-for-investment-advisors,11-Feb-22,2/11/2022 0:00
46,PancakeSwap DEX reportedly set to block users from Iran,https://www.tbstat.com/wp/uploads/2019/05/iran-1-800x450.jpg,https://coinmarketcal.com/en/news/pancakeswap-dex-reportedly-set-to-block-users-from-iran,11-Feb-22,2/11/2022 0:00
47,Couple accused of laundering $4.5 billion in bitcoin face bail decision in DC,https://www.tbstat.com/wp/uploads/2020/06/20200626_Crypto_Legal-Daily-800x450.jpg,https://coinmarketcal.com/en/news/couple-accused-of-laundering-4-5-billion-in-bitcoin-face-bail-decision-in-dc,11-Feb-22,2/11/2022 0:00
48,OnlyFans launches verified NFT profile pictures,https://www.tbstat.com/wp/uploads/2021/06/20210601_NFT_Generic-800x450.jpg,https://coinmarketcal.com/en/news/onlyfans-launches-verified-nft-profile-pictures,10-Feb-22,2/10/2022 0:00
49,Creator of Vine and Loot raises $12 million for NFT-powered sci-fi project,https://www.tbstat.com/wp/uploads/2019/04/money-800x450.jpg,https://coinmarketcal.com/en/news/creator-of-vine-and-loot-raises-12-million-for-nft-powered-sci-fi-project,10-Feb-22,2/10/2022 0:00
50,"As Congress weighs stablecoins, Tether emerges as a regulatory boogeyman",https://www.tbstat.com/wp/uploads/2020/09/20200914_Tether-800x450.jpg,https://coinmarketcal.com/en/news/as-congress-weighs-stablecoins-tether-emerges-as-a-regulatory-boogeyman,10-Feb-22,2/10/2022 0:00
51,Somnium Space: VR-Focused Virtual Real Estate,https://www.tbstat.com/wp/uploads/2022/01/220125_Somnium_Space_Research_-800x450.jpg,https://coinmarketcal.com/en/news/somnium-space-vr-focused-virtual-real-estate,10-Feb-22,2/10/2022 0:00
52,Ethereum scaling startup Optimism discloses ‘critical bug’ fix,https://www.tbstat.com/wp/uploads/2021/12/211203_Ethereum_General2-800x450.jpg,https://coinmarketcal.com/en/news/ethereum-scaling-startup-optimism-discloses-critical-bug-fix,10-Feb-22,2/10/2022 0:00
53,Tranchess: a tokenized structured fund protocol,https://www.tbstat.com/wp/uploads/2022/01/220126_Tranchess_Protocol_Research-800x450.jpg,https://coinmarketcal.com/en/news/tranchess-a-tokenized-structured-fund-protocol,10-Feb-22,2/10/2022 0:00
54,Fitch downgrades El Salvador rating on debt concerns,https://www.tbstat.com/wp/uploads/2021/06/20210628_El_Salvador_Generic-800x450.png,https://coinmarketcal.com/en/news/fitch-downgrades-el-salvador-rating-on-debt-concerns,10-Feb-22,2/10/2022 0:00
55,YouTube sees ‘incredible potential’ in Web3 and NFTs,https://www.tbstat.com/wp/uploads/2020/05/20200512_Blockchain_Focus-800x450.jpg,https://coinmarketcal.com/en/news/youtube-sees-incredible-potential-in-web3-and-nfts,10-Feb-22,2/10/2022 0:00
56,Humanode raises $2M led by Republic Capital while the testnet hits 1650 unique validators,https://d32bfp67k1q0s7.cloudfront.net/cb5547036948e559c547ff21fb1114af.png,https://coinmarketcal.com/en/news/humanode-raises-2m-led-by-republic-capital-while-the-testnet-hits-1650-unique-validators,10-Feb-22,2/10/2022 0:00
57,"Digital euro legislation planned for next year, EU official says",https://www.tbstat.com/wp/uploads/2020/12/shutterstock_584623759-675x450.jpg,https://coinmarketcal.com/en/news/digital-euro-legislation-planned-for-next-year-eu-official-says,10-Feb-22,2/10/2022 0:00
58,TRON DAO Launches The TRON Grand Hackathon 2022 In Partnership With BitTorrent Chain,https://d32bfp67k1q0s7.cloudfront.net/1e125acf056f0f31000d840da38d3a46.png,https://coinmarketcal.com/en/news/tron-dao-launches-the-tron-grand-hackathon-2022-in-partnership-with-bittorrent-chain,10-Feb-22,2/10/2022 0:00
59,New Hampshire governor establishes new commission to study crypto,https://www.tbstat.com/wp/uploads/2019/04/legal-letter-law-lawyer-800x450.jpg,https://coinmarketcal.com/en/news/new-hampshire-governor-establishes-new-commission-to-study-crypto,10-Feb-22,2/10/2022 0:00
60,Binance is taking a $200 million stake in Forbes — the publication it once briefly sued for defamation,https://www.tbstat.com/wp/uploads/2021/12/2021_Changpeng-Zhao-CZ-Binance-800x450.jpg,https://coinmarketcal.com/en/news/binance-is-taking-a-200-million-stake-in-forbes-the-publication-it-once-briefly-sued-for-defamation,10-Feb-22,2/10/2022 0:00
61,Russia shuts down darknet sites that had made $263 million in crypto,https://www.tbstat.com/wp/uploads/2021/04/20210402_Cybercrime_Generic-800x450.jpg,https://coinmarketcal.com/en/news/russia-shuts-down-darknet-sites-that-had-made-263-million-in-crypto,10-Feb-22,2/10/2022 0:00
62,"Layer by Layer Issue 20: Polkadot, Cosmos, Terra, and Avalanche",https://www.tbstat.com/wp/uploads/2021/07/20210723_Layer_by_Layer-research-797x450.jpg,https://coinmarketcal.com/en/news/layer-by-layer-issue-20-polkadot-cosmos-terra-and-avalanche,10-Feb-22,2/10/2022 0:00
63,Crypto firms face cliff-edge in UK as time ticks down for AML approval,https://www.tbstat.com/wp/uploads/2019/09/20190925_London-Blockchain-Map-Genesis-800x450.jpg,https://coinmarketcal.com/en/news/crypto-firms-face-cliff-edge-in-uk-as-time-ticks-down-for-aml-approval,10-Feb-22,2/10/2022 0:00
64,Can a neobank ever be built on DeFi rails?,https://www.tbstat.com/wp/uploads/2022/02/20220207_Neo-Bank-DeFi-800x450.jpg,https://coinmarketcal.com/en/news/can-a-neobank-ever-be-built-on-defi-rails,10-Feb-22,2/10/2022 0:00
65,Concordium Blockchain Officially Launches Its CCD Token On Bitfinex and BitGlobal,https://d32bfp67k1q0s7.cloudfront.net/fe7b42ed69ed66650b62a1d00dd1a3a2.png,https://coinmarketcal.com/en/news/concordium-blockchain-officially-launches-its-ccd-token-on-bitfinex-and-bitglobal,10-Feb-22,2/10/2022 0:00
66,Gucci buys virtual land on The Sandbox as part of metaverse experience bid,https://www.tbstat.com/wp/uploads/2022/01/20220118_NFT_Digital_Funding_Metaverse-800x450.jpg,https://coinmarketcal.com/en/news/gucci-buys-virtual-land-on-the-sandbox-as-part-of-metaverse-experience-bid,10-Feb-22,2/10/2022 0:00
67,El Salvador plans to issue first bitcoin bond next month,https://www.tbstat.com/wp/uploads/2021/06/20210628_El_Salvador_Bitcoin-800x450.png,https://coinmarketcal.com/en/news/el-salvador-plans-to-issue-first-bitcoin-bond-next-month,9-Feb-22,2/9/2022 0:00
68,Investment firm KKR to up Animoca Brands’ newest funding to $500 million: report,https://www.tbstat.com/wp/uploads/2022/01/20220117_Funding_Increase_Numbers-800x450.jpg,https://coinmarketcal.com/en/news/investment-firm-kkr-to-up-animoca-brands-newest-funding-to-500-million-report,9-Feb-22,2/9/2022 0:00
69,An overview of zero knowledge projects,https://www.tbstat.com/wp/uploads/2022/01/220128_ZK_Projects_Research-800x450.jpg,https://coinmarketcal.com/en/news/an-overview-of-zero-knowledge-projects,9-Feb-22,2/9/2022 0:00
70,Gaming giant Zynga plans to launch NFT-based game this year,https://www.tbstat.com/wp/uploads/2019/07/game-gaming-playing-800x450.jpg,https://coinmarketcal.com/en/news/gaming-giant-zynga-plans-to-launch-nft-based-game-this-year,9-Feb-22,2/9/2022 0:00
71,BlackRock plans to offer crypto trading services: report,https://www.tbstat.com/wp/uploads/2020/01/shutterstock_1324038479-675x450.jpg,https://coinmarketcal.com/en/news/blackrock-plans-to-offer-crypto-trading-services-report,9-Feb-22,2/9/2022 0:00
72,How Magic Eden became the OpenSea of Solana,https://www.tbstat.com/wp/uploads/2022/02/20220207_Magic_Eden_Solana_NFT-800x450.jpg,https://coinmarketcal.com/en/news/how-magic-eden-became-the-opensea-of-solana,9-Feb-22,2/9/2022 0:00
73,Tennessee lawmaker proposes allowing the state to invest in cryptocurrencies and NFTs,https://www.tbstat.com/wp/uploads/2019/01/courtroom-1-800x450.jpg,https://coinmarketcal.com/en/news/tennessee-lawmaker-proposes-allowing-the-state-to-invest-in-cryptocurrencies-and-nfts,9-Feb-22,2/9/2022 0:00
74,Baseball team Washington Nationals inks sponsorship deal with Terra,https://www.tbstat.com/wp/uploads/2022/02/FLKxYyrWYAYEQYw-800x450.jpg,https://coinmarketcal.com/en/news/baseball-team-washington-nationals-inks-sponsorship-deal-with-terra,9-Feb-22,2/9/2022 0:00
75,Bitcoin payment processor OpenNode raises $20 million from Twitter and others,https://www.tbstat.com/wp/uploads/2021/10/20211001_Bitcoin_Generic-800x450.jpg,https://coinmarketcal.com/en/news/bitcoin-payment-processor-opennode-raises-20-million-from-twitter-and-others,9-Feb-22,2/9/2022 0:00
76,"Volt Inu ($VOLT) Lists on Hotbit, Xt and Bitmart Exchanges",https://d32bfp67k1q0s7.cloudfront.net/cd0df31360274924372efb1db618fd88.png,https://coinmarketcal.com/en/news/volt-inu-volt-lists-on-hotbit-xt-and-bitmart-exchanges,9-Feb-22,2/9/2022 0:00
77,"CULT DAO Takes Decentralization to Extreme Levels, Awakening Revolution",https://d32bfp67k1q0s7.cloudfront.net/aa356b072b9d536474b4310dc454a91c.png,https://coinmarketcal.com/en/news/cult-dao-takes-decentralization-to-extreme-levels-awakening-revolution,9-Feb-22,2/9/2022 0:00
78,"Before Senate, CFTC cites crypto as basis for biggest expansion since Dodd-Frank",https://www.tbstat.com/wp/uploads/2020/04/CFTC-675x450.jpg,https://coinmarketcal.com/en/news/before-senate-cftc-cites-crypto-as-basis-for-biggest-expansion-since-dodd-frank,9-Feb-22,2/9/2022 0:00
79,AssangeDAO wins Julian Assange x Pak NFT for $53 million,https://www.tbstat.com/wp/uploads/2022/02/Webp.net-resizeimage18-800x450.jpg,https://coinmarketcal.com/en/news/assangedao-wins-julian-assange-x-pak-nft-for-53-million,9-Feb-22,2/9/2022 0:00
80,Revolut seeks senior blockchain engineers amid token rumours,https://www.tbstat.com/wp/uploads/2021/07/20210720_Nikolay_Storonsky-800x450.jpg,https://coinmarketcal.com/en/news/revolut-seeks-senior-blockchain-engineers-amid-token-rumours,9-Feb-22,2/9/2022 0:00
81,Bitcoin mining infrastructure firm Compute North raises $385 million in equity and debt funding,https://www.tbstat.com/wp/uploads/2021/12/20211213_Evolution_of_bitcoin_Mining-800x450.jpg,https://coinmarketcal.com/en/news/bitcoin-mining-infrastructure-firm-compute-north-raises-385-million-in-equity-and-debt-funding,9-Feb-22,2/9/2022 0:00
82,"Romanian cryptocurrency platform Tradesilvania.com appoints Mihaela Dr?goiu, former Head of Supervision and Control Directorate of FIU Romania (ONPCSB) as the new Risk & Regulatory Affairs Director",https://d32bfp67k1q0s7.cloudfront.net/dcf0af9ed9e3f0108b52a57f15afd465.png,https://coinmarketcal.com/en/news/romanian-cryptocurrency-platform-tradesilvania-com-appoints-mihaela-dragoiu-former-head-of-supervision-and-control-directorate-o,9-Feb-22,2/9/2022 0:00
83,Russia set to recognize crypto as a form of currency: report,https://www.tbstat.com/wp/uploads/2019/10/shutterstock_440734837-675x450.jpg,https://coinmarketcal.com/en/news/russia-set-to-recognize-crypto-as-a-form-of-currency-report,9-Feb-22,2/9/2022 0:00
84,Polychain and Coinbase alum Sam Rosenblum joins KRH Partners,https://www.tbstat.com/wp/uploads/2020/07/20200707_Investment-Daily-800x450.jpg,https://coinmarketcal.com/en/news/polychain-and-coinbase-alum-sam-rosenblum-joins-krh-partners,9-Feb-22,2/9/2022 0:00
85,"Luntivo Finance, a new generation DEX, announces its limited-time Coin Offering",https://i.ibb.co/ry5q8kB/photo-2022-02-09-12-31-46.jpg,https://coinmarketcal.com/en/news/luntivo-finance-a-new-generation-dex-announces-its-limited-time-coin-offering,9-Feb-22,2/9/2022 0:00
86,DMN Releasing a Series of P2E Games,https://i.ibb.co/RhqMsvJ/photo-2022-02-09-12-44-42.jpg,https://coinmarketcal.com/en/news/dmn-releasing-a-series-of-p2e-games,9-Feb-22,2/9/2022 0:00
87,Everything You Need to Know about AAVE,https://coinmarketcal.com/images/coinmarketcal-placeholder.jpg,https://coinmarketcal.com/en/news/everything-you-need-to-know-about-aave,9-Feb-22,2/9/2022 0:00
88,Web traffic to crypto exchanges fell 8% month-over-month in January,https://www.tbstat.com/wp/uploads/2021/02/20210217_Crypto_Retail_Systemic_Risk-800x450.jpg,https://coinmarketcal.com/en/news/web-traffic-to-crypto-exchanges-fell-8-month-over-month-in-january,8-Feb-22,2/8/2022 0:00
89,"Wife of couple accused of $4.5 billion Bitcoin swindle gave advice on cybersecurity, social engineering",https://www.tbstat.com/wp/uploads/2022/02/Webp.net-resizeimage20-800x450.jpg,https://coinmarketcal.com/en/news/wife-of-couple-accused-of-4-5-billion-bitcoin-swindle-gave-advice-on-cybersecurity-social-engineering,8-Feb-22,2/8/2022 0:00
90,An overview of new Bitcoin mining power capacities in the Americas,https://www.tbstat.com/wp/uploads/2021/12/20211220_mining_outlook-Research-800x450.jpg,https://coinmarketcal.com/en/news/an-overview-of-new-bitcoin-mining-power-capacities-in-the-americas,8-Feb-22,2/8/2022 0:00
91,Treasury official behind stablecoin report to testify at Senate hearing next week,https://www.tbstat.com/wp/uploads/2021/08/20210831_Crypto_Congress_Progressives-800x450.jpg,https://coinmarketcal.com/en/news/treasury-official-behind-stablecoin-report-to-testify-at-senate-hearing-next-week,8-Feb-22,2/8/2022 0:00
