key,news,img,link,date_str,date_parsed
2277,Binance is launching its own NFT marketplace in June,https://www.tbstat.com/wp/uploads/2019/05/Changpeng-Zhao-1-800x450.jpg,https://coinmarketcal.com/en/news/binance-is-launching-its-own-nft-marketplace-in-june,27-Apr-21,4/27/2021 0:00
2278,Q1 earnings show Tesla sold off $272 million of its BTC purchase,https://www.tbstat.com/wp/uploads/2021/02/20210208_Bitcoin-Tesla-Elon-Musk-800x450.jpg,https://coinmarketcal.com/en/news/q1-earnings-show-tesla-sold-off-272-million-of-its-btc-purchase,26-Apr-21,4/26/2021 0:00
2279,"Why MetaKovan, the buyer of the $69 million Beeple NFT, thinks the token is actually worth $1 billion",https://www.tbstat.com/wp/uploads/2021/04/20210412_Vignesh_Sundaresan_Beeple-800x450.jpg,https://coinmarketcal.com/en/news/why-metakovan-the-buyer-of-the-69-million-beeple-nft-thinks-the-token-is-actually-worth-1-billion,26-Apr-21,4/26/2021 0:00
2280,Sean Culkin of the Kansas City Chiefs becomes first NFL player to convert entire salary to bitcoin,https://www.tbstat.com/wp/uploads/2020/12/hence-the-boom-uS4an493LkY-unsplash-800x450.jpg,https://coinmarketcal.com/en/news/sean-culkin-of-the-kansas-city-chiefs-becomes-first-nfl-player-to-convert-entire-salary-to-bitcoin,26-Apr-21,4/26/2021 0:00
2281,JPMorgan is preparing to offer an actively managed bitcoin fund: Report,https://www.tbstat.com/wp/uploads/2020/10/20201026_JPMorgan-Crypto-Org-800x450.jpg,https://coinmarketcal.com/en/news/jpmorgan-is-preparing-to-offer-an-actively-managed-bitcoin-fund-report,26-Apr-21,4/26/2021 0:00
2282,"Tether’s market cap tops $50 billion, supply on Tron surpasses Ethereum",https://www.tbstat.com/wp/uploads/2020/09/20200914_Tether-800x450.jpg,https://coinmarketcal.com/en/news/tethers-market-cap-tops-50-billion-supply-on-tron-surpasses-ethereum,26-Apr-21,4/26/2021 0:00
2283,Decentralized Trading Protocol Marginswap Launches with Native Support for Spot and Leverage Trading of Tokens on AMMs,https://coinmarketcal-share.s3-eu-west-1.amazonaws.com/News/photo_2021-04-26+09.18.06.jpeg,https://coinmarketcal.com/en/news/decentralized-trading-protocol-marginswap-launches-with-native-support-for-spot-and-leverage-trading-of-tokens-on-amms,26-Apr-21,4/26/2021 0:00
2284,3 coins to keep an eye on | Issue #127,https://bucket.mlcdn.com/a/1227/1227214/images/aff339cab7da7465156385b70b8a4782ba03b533.png,https://coinmarketcal.com/en/news/3-coins-to-keep-an-eye-on-issue-127,26-Apr-21,4/26/2021 0:00
2285,April’s crypto exchange volumes have hit a new all-time high,https://www.tbstat.com/wp/uploads/2020/05/20200527_Stablecoin_Exchanges-Daily-800x450.jpg,https://coinmarketcal.com/en/news/aprils-crypto-exchange-volumes-have-hit-a-new-all-time-high,24-Apr-21,4/24/2021 0:00
2286,Seven USDC wallet addresses were blacklisted on Wednesday,https://www.tbstat.com/wp/uploads/2021/04/20210402_Cybercrime_Generic_G-800x450.jpg,https://coinmarketcal.com/en/news/seven-usdc-wallet-addresses-were-blacklisted-on-wednesday,23-Apr-21,4/23/2021 0:00
2287,Paxos becomes latest crypto company to score OCC approval for a bank charter,https://www.tbstat.com/wp/uploads/2020/12/20201216_Paxos_142m-Daily-800x450.png,https://coinmarketcal.com/en/news/paxos-becomes-latest-crypto-company-to-score-occ-approval-for-a-bank-charter,23-Apr-21,4/23/2021 0:00
2288,"Charles Schwab needs regulatory clarity before offering crypto trading service, says CEO",https://www.tbstat.com/wp/uploads/2021/03/20210303_Charles_Schwab_Bitcoin-800x450.jpg,https://coinmarketcal.com/en/news/charles-schwab-needs-regulatory-clarity-before-offering-crypto-trading-service-says-ceo,23-Apr-21,4/23/2021 0:00
2289,Crypto index fund run by Bitwise files to become SEC reporting company,https://www.tbstat.com/wp/uploads/2018/12/Bitwise-800x450.jpg,https://coinmarketcal.com/en/news/crypto-index-fund-run-by-bitwise-files-to-become-sec-reporting-company,23-Apr-21,4/23/2021 0:00
2290,Turkish police detain 62 people in crypto exchange Thodex investigation,https://www.tbstat.com/wp/uploads/2019/02/turkeydata-675x450.jpg,https://coinmarketcal.com/en/news/turkish-police-detain-62-people-in-crypto-exchange-thodex-investigation,23-Apr-21,4/23/2021 0:00
2291,GBTC sinks to record low — trading at a 19% discount,https://www.tbstat.com/wp/uploads/2021/01/20210121_GBTC-Daily-800x450.png,https://coinmarketcal.com/en/news/gbtc-sinks-to-record-low-trading-at-a-19-discount,23-Apr-21,4/23/2021 0:00
2292,Coinbase Pro announces support for Tether’s Ethereum-based USDT stablecoin,https://www.tbstat.com/wp/uploads/2021/01/20210126_coinbase_C-Daily-800x450.jpg,https://coinmarketcal.com/en/news/coinbase-pro-announces-support-for-tethers-ethereum-based-usdt-stablecoin,23-Apr-21,4/23/2021 0:00
2293,How Do You Stake a Bitcoin?,https://coinmarketcal-share.s3-eu-west-1.amazonaws.com/News/CoinMarketCal+%7C+stake+bitcoin.png,https://coinmarketcal.com/en/news/how-do-you-stake-a-bitcoin,23-Apr-21,4/23/2021 0:00
2294,Silvergate posts strong Q1 and says it’s looking to stablecoins as a growth avenue,https://www.tbstat.com/wp/uploads/2019/06/20190610_Silvergate-Bank-800x450.jpg,https://coinmarketcal.com/en/news/silvergate-posts-strong-q1-and-says-its-looking-to-stablecoins-as-a-growth-avenue,22-Apr-21,4/22/2021 0:00
2295,USMS awards BitGo a $4.5M contract to help it hold and auction seized crypto,https://www.tbstat.com/wp/uploads/2019/05/bitgo-800x450.jpg,https://coinmarketcal.com/en/news/usms-awards-bitgo-a-4-5m-contract-to-help-it-hold-and-auction-seized-crypto,22-Apr-21,4/22/2021 0:00
2296,Controversy over a new academic paper spotlights how difficult it is to measure bitcoin’s carbon footprint,https://www.tbstat.com/wp/uploads/2021/04/20210420_BTC_Mining_Emissions-797x450.jpg,https://coinmarketcal.com/en/news/controversy-over-a-new-academic-paper-spotlights-how-difficult-it-is-to-measure-bitcoins-carbon-footprint,22-Apr-21,4/22/2021 0:00
2297,Bitcoin’s hash rate set to regain loss as Xinjiang miners gradually resume operations,https://www.tbstat.com/wp/uploads/2020/10/20201028_Shutterstock-Bitcoin-Miner-Mining-800x450.jpg,https://coinmarketcal.com/en/news/bitcoins-hash-rate-set-to-regain-loss-as-xinjiang-miners-gradually-resume-operations,22-Apr-21,4/22/2021 0:00
2298,"Ether price hits new highs above $2,560",https://www.tbstat.com/wp/uploads/2021/04/20210409_Ethereum_Generic_s-800x450.jpg,https://coinmarketcal.com/en/news/ether-price-hits-new-highs-above-2-560,22-Apr-21,4/22/2021 0:00
2299,Turkish crypto exchange Thodex accused of fraud: report,https://www.tbstat.com/wp/uploads/2019/02/turkeydata-675x450.jpg,https://coinmarketcal.com/en/news/turkish-crypto-exchange-thodex-accused-of-fraud-report,22-Apr-21,4/22/2021 0:00
2300,Binance under the lens of European regulators for stock token offering: Report,https://www.tbstat.com/wp/uploads/2019/05/Changpeng-Zhao-1-800x450.jpg,https://coinmarketcal.com/en/news/binance-under-the-lens-of-european-regulators-for-stock-token-offering-report,22-Apr-21,4/22/2021 0:00
2301,"BitMEX lays out ambitions to expand business into spot, custody, and education services",https://www.tbstat.com/wp/uploads/2020/05/20200518_Bitmex-Daily-800x450.jpg,https://coinmarketcal.com/en/news/bitmex-lays-out-ambitions-to-expand-business-into-spot-custody-and-education-services,22-Apr-21,4/22/2021 0:00
2302,Hard drive prices surge as Chinese investors flock to Chia mining,https://www.tbstat.com/wp/uploads/2021/04/20210421_Hard_Disk_Surge_China-800x450.jpg,https://coinmarketcal.com/en/news/hard-drive-prices-surge-as-chinese-investors-flock-to-chia-mining,21-Apr-21,4/21/2021 0:00
2303,"For some investors, Coinbase’s stock is a stand-in for the long-awaited bitcoin ETF",https://www.tbstat.com/wp/uploads/2021/04/20210416_Coinbase_Generic_Stocks-800x450.jpg,https://coinmarketcal.com/en/news/for-some-investors-coinbases-stock-is-a-stand-in-for-the-long-awaited-bitcoin-etf,21-Apr-21,4/21/2021 0:00
2304,"Bill aimed at linking up SEC, CFTC for crypto-focused task force passes US House, heads for the Senate",https://www.tbstat.com/wp/uploads/2019/07/congress-outside-2-alt-800x450.jpg,https://coinmarketcal.com/en/news/bill-aimed-at-linking-up-sec-cftc-for-crypto-focused-task-force-passes-us-house-heads-for-the-senate,21-Apr-21,4/21/2021 0:00
2305,"The US General Services Administration to auction off more than $500,000 in bitcoin this Friday",https://www.tbstat.com/wp/uploads/2021/02/20210219_Bitcoin_ETF_Generic-800x450.jpg,https://coinmarketcal.com/en/news/the-us-general-services-administration-to-auction-off-more-than-500-000-in-bitcoin-this-friday,21-Apr-21,4/21/2021 0:00
2306,Coinbase commits to devoting 10 percent of its resources to ‘innovation bets’,https://www.tbstat.com/wp/uploads/2021/02/20210225_Coinbase_Gen_1-800x450.jpg,https://coinmarketcal.com/en/news/coinbase-commits-to-devoting-10-percent-of-its-resources-to-innovation-bets,21-Apr-21,4/21/2021 0:00
2307,£3.8 billion investment trust acquires stake in crypto exchange Kraken,https://www.tbstat.com/wp/uploads/2019/09/20190926_Kraken-Overview-Daily-800x450.jpg,https://coinmarketcal.com/en/news/ps3-8-billion-investment-trust-acquires-stake-in-crypto-exchange-kraken,21-Apr-21,4/21/2021 0:00
2308,BitGo’s $700 million crypto custody insurance program: what it means and why it matters,https://www.tbstat.com/wp/uploads/2019/07/safe-custody-savings-800x450.jpg,https://coinmarketcal.com/en/news/bitgos-700-million-crypto-custody-insurance-program-what-it-means-and-why-it-matters,21-Apr-21,4/21/2021 0:00
2309,Deutsche Telekom invests in the mobile-focused public blockchain Celo,https://www.tbstat.com/wp/uploads/2019/02/mobile-payment-800x450.jpg,https://coinmarketcal.com/en/news/deutsche-telekom-invests-in-the-mobile-focused-public-blockchain-celo,20-Apr-21,4/20/2021 0:00
2310,"IBM, patent marketplace IPwe plan to turn patents into NFTs",https://www.tbstat.com/wp/uploads/2019/06/IBM-3-800x450.jpg,https://coinmarketcal.com/en/news/ibm-patent-marketplace-ipwe-plan-to-turn-patents-into-nfts,20-Apr-21,4/20/2021 0:00
2311,Three Ether ETFs begin trading on Toronto Stock Exchange,https://www.tbstat.com/wp/uploads/2021/04/20210409_Ethereum_Generic-800x450.jpg,https://coinmarketcal.com/en/news/three-ether-etfs-begin-trading-on-toronto-stock-exchange,20-Apr-21,4/20/2021 0:00
2312,Visa wants to help you pay with central bank digital currency,https://www.tbstat.com/wp/uploads/2021/04/20210419_Cuy_Sheffield-800x450.jpg,https://coinmarketcal.com/en/news/visa-wants-to-help-you-pay-with-central-bank-digital-currency,20-Apr-21,4/20/2021 0:00
2313,Andreessen Horowitz leads $28 million round for zero-knowledge private applications platform,https://www.tbstat.com/wp/uploads/2021/03/20210309_a16z_NFT_-800x450.jpg,https://coinmarketcal.com/en/news/andreessen-horowitz-leads-28-million-round-for-zero-knowledge-private-applications-platform,20-Apr-21,4/20/2021 0:00
2314,Injective Protocol raises $10 million from Mark Cuban and other investors,https://www.tbstat.com/wp/uploads/2021/04/20210402_Funding_Generic-800x450.jpg,https://coinmarketcal.com/en/news/injective-protocol-raises-10-million-from-mark-cuban-and-other-investors,20-Apr-21,4/20/2021 0:00
2315,Former CFTC chair Giancarlo joins BlockFi’s board,https://www.tbstat.com/wp/uploads/2020/05/20200511_Giancarlo-Digital-Dollar-800x450.jpg,https://coinmarketcal.com/en/news/former-cftc-chair-giancarlo-joins-blockfis-board,20-Apr-21,4/20/2021 0:00
2316,"WeWork now accepts bitcoin for payments, will hold on balance sheet",https://www.tbstat.com/wp/uploads/2021/04/wework-676x450.jpeg,https://coinmarketcal.com/en/news/wework-now-accepts-bitcoin-for-payments-will-hold-on-balance-sheet,20-Apr-21,4/20/2021 0:00
2317,PayPal’s Venmo now allows users to buy and sell crypto,https://www.tbstat.com/wp/uploads/2019/04/Paypal_san_jose-600x450.jpg,https://coinmarketcal.com/en/news/paypals-venmo-now-allows-users-to-buy-and-sell-crypto,20-Apr-21,4/20/2021 0:00
2318,Former top banking regulator Brian Brooks to become CEO of Binance.US,https://www.tbstat.com/wp/uploads/2020/05/20200515_Binance_Mining_Pool-Daily_B-800x450.jpg,https://coinmarketcal.com/en/news/former-top-banking-regulator-brian-brooks-to-become-ceo-of-binance-us,20-Apr-21,4/20/2021 0:00
2319,Nasdaq to list options for Coinbase stock,https://www.tbstat.com/wp/uploads/2021/04/20210413_Nasdaq_Coinbase-800x450.jpg,https://coinmarketcal.com/en/news/nasdaq-to-list-options-for-coinbase-stock,20-Apr-21,4/20/2021 0:00
2320,Gary Gensler is now head of the SEC. What comes next?,https://www.tbstat.com/wp/uploads/2020/11/20201113_GaryGensler-Daily-800x450.jpg,https://coinmarketcal.com/en/news/gary-gensler-is-now-head-of-the-sec-what-comes-next,19-Apr-21,4/19/2021 0:00
2321,Time Magazine now accepts bitcoin and other cryptocurrencies for digital subscriptions,https://www.tbstat.com/wp/uploads/2021/04/time-800x335.jpeg,https://coinmarketcal.com/en/news/time-magazine-now-accepts-bitcoin-and-other-cryptocurrencies-for-digital-subscriptions,19-Apr-21,4/19/2021 0:00
2322,Crypto exchange OKEx integrates Bitcoin’s Lightning Network,https://www.tbstat.com/wp/uploads/2021/02/20210216_Mining_Bitcoin_2_Generic-800x450.jpg,https://coinmarketcal.com/en/news/crypto-exchange-okex-integrates-bitcoins-lightning-network,19-Apr-21,4/19/2021 0:00
2323,Listed Korean firm Gamevil to acquire $28 million stake in local crypto exchange Coinone,https://www.tbstat.com/wp/uploads/2019/06/south-korea-flag-building-800x450.jpg,https://coinmarketcal.com/en/news/listed-korean-firm-gamevil-to-acquire-28-million-stake-in-local-crypto-exchange-coinone,19-Apr-21,4/19/2021 0:00
2324,"Bank of England, HM Treasury establish new taskforce to explore digital currency",https://www.tbstat.com/wp/uploads/2020/06/20200618_UK-Regulation-Crypto-Exchanges-Daily-800x450.jpg,https://coinmarketcal.com/en/news/bank-of-england-hm-treasury-establish-new-taskforce-to-explore-digital-currency,19-Apr-21,4/19/2021 0:00
2325,PBoC vice governor says China regards crypto assets as investment alternatives,https://www.tbstat.com/wp/uploads/2019/09/shutterstock_568353928-729x450.jpg,https://coinmarketcal.com/en/news/pboc-vice-governor-says-china-regards-crypto-assets-as-investment-alternatives,19-Apr-21,4/19/2021 0:00
2326,CME Group is not launching dogecoin futures,https://www.tbstat.com/wp/uploads/2020/05/20200515_CME-Daily-800x450.jpg,https://coinmarketcal.com/en/news/cme-group-is-not-launching-dogecoin-futures,19-Apr-21,4/19/2021 0:00
2327,3 coins to keep an eye on | Issue #126,https://bucket.mlcdn.com/a/1227/1227214/images/eec5f5ab3fa04a51eb1c5981810ea00c3ec78eae.png,https://coinmarketcal.com/en/news/3-coins-to-keep-an-eye-on-issue-126,19-Apr-21,4/19/2021 0:00
2328,Weekend market tumult triggers record number of crypto futures liquidations,https://www.tbstat.com/wp/uploads/2021/04/20210402_Bitcoin_Generic-800x450.jpg,https://coinmarketcal.com/en/news/weekend-market-tumult-triggers-record-number-of-crypto-futures-liquidations,18-Apr-21,4/18/2021 0:00
2329,Differentiating Between Bitcoin and Blockchain,https://coinmarketcal-share.s3-eu-west-1.amazonaws.com/News/GreenBTC.jpg,https://coinmarketcal.com/en/news/differentiating-between-bitcoin-and-blockchain,18-Apr-21,4/18/2021 0:00
2330,Do Cryptocurrencies Need Governance?,https://coinmarketcal-share.s3-eu-west-1.amazonaws.com/News/governance.jpg,https://coinmarketcal.com/en/news/do-cryptocurrencies-need-governance,18-Apr-21,4/18/2021 0:00
2331,Aggregated open interest of Ethereum options reaches all time high ,https://www.tbstat.com/wp/uploads/2021/04/20210409_Ethereum_Generic-800x450.jpg,https://coinmarketcal.com/en/news/aggregated-open-interest-of-ethereum-options-reaches-all-time-high,17-Apr-21,4/17/2021 0:00
2332,Billionaire Mark Cuban invests in NFT data platform CryptoSlam,https://www.tbstat.com/wp/uploads/2021/03/20210322_Mark_Cuban_NFT-800x450.jpg,https://coinmarketcal.com/en/news/billionaire-mark-cuban-invests-in-nft-data-platform-cryptoslam,17-Apr-21,4/17/2021 0:00
2333,Revolutionizing Penny & NFTs auctions on the binance smart chain!,https://coinmarketcal-share.s3-eu-west-1.amazonaws.com/News/firstimage2.png,https://coinmarketcal.com/en/news/revolutionizing-penny-nfts-auctions-on-the-binance-smart-chain,17-Apr-21,4/17/2021 0:00
2334,New funding round will value NFT startup Dapper Labs at more than $7.5 billion: report,https://www.tbstat.com/wp/uploads/2021/02/20210212_DapperLabs_1-800x450.jpg,https://coinmarketcal.com/en/news/new-funding-round-will-value-nft-startup-dapper-labs-at-more-than-7-5-billion-report,16-Apr-21,4/16/2021 0:00
2335,Dogecoin mania leads to Robinhood crypto order failures,https://www.tbstat.com/wp/uploads/2020/07/20200708_Dogecoin-Up-800x450.jpg,https://coinmarketcal.com/en/news/dogecoin-mania-leads-to-robinhood-crypto-order-failures,16-Apr-21,4/16/2021 0:00
2336,Cathie Wood’s ARK funds bought more Coinbase shares worth over $110 million,https://www.tbstat.com/wp/uploads/2021/01/20210126_coinbase_L-Daily-800x450.jpg,https://coinmarketcal.com/en/news/cathie-woods-ark-funds-bought-more-coinbase-shares-worth-over-110-million,16-Apr-21,4/16/2021 0:00
2337,Cryptology Asset Group raises €32 million and explores buying bitcoin,https://www.tbstat.com/wp/uploads/2018/11/malta-business-800x450.jpg,https://coinmarketcal.com/en/news/cryptology-asset-group-raises-eur32-million-and-explores-buying-bitcoin,16-Apr-21,4/16/2021 0:00
2338,Binance destroys $595 million worth of BNB tokens in its largest-ever burn,https://www.tbstat.com/wp/uploads/2019/05/Changpeng-Zhao-1-800x450.jpg,https://coinmarketcal.com/en/news/binance-destroys-595-million-worth-of-bnb-tokens-in-its-largest-ever-burn,16-Apr-21,4/16/2021 0:00
2339,Turkey’s central bank bans the use of cryptocurrencies for payments,https://www.tbstat.com/wp/uploads/2019/02/turkeydata-675x450.jpg,https://coinmarketcal.com/en/news/turkeys-central-bank-bans-the-use-of-cryptocurrencies-for-payments,16-Apr-21,4/16/2021 0:00
2340,China coal mine accidents may be behind bitcoin’s hash rate drop,https://www.tbstat.com/wp/uploads/2020/05/bitcoin-mining-1-800x450.jpg,https://coinmarketcal.com/en/news/china-coal-mine-accidents-may-be-behind-bitcoins-hash-rate-drop,16-Apr-21,4/16/2021 0:00
2341,New Regulations for Cryptocurrency Traders in Canada,https://coinmarketcal.com/images/coinmarketcal-placeholder.jpg,https://coinmarketcal.com/en/news/new-regulations-for-cryptocurrency-traders-in-canada,16-Apr-21,4/16/2021 0:00
2342,Coinbase nabs a top 10 slot in Apple’s US App Store for the first time since January,https://www.tbstat.com/wp/uploads/2021/01/20210126_coinbase_C-Daily-800x450.jpg,https://coinmarketcal.com/en/news/coinbase-nabs-a-top-10-slot-in-apples-us-app-store-for-the-first-time-since-january,15-Apr-21,4/15/2021 0:00
2343,Proposed Miami-Dade crypto task force would explore whether to accept crypto for county payments,https://www.tbstat.com/wp/uploads/2019/04/miami-675x450.jpg,https://coinmarketcal.com/en/news/proposed-miami-dade-crypto-task-force-would-explore-whether-to-accept-crypto-for-county-payments,15-Apr-21,4/15/2021 0:00
2344,Biden calls out crypto’s use in sanctions evasion in executive order response to Russian cyberattacks,https://www.tbstat.com/wp/uploads/2019/07/Joe-Biden-1-800x450.jpg,https://coinmarketcal.com/en/news/biden-calls-out-cryptos-use-in-sanctions-evasion-in-executive-order-response-to-russian-cyberattacks,15-Apr-21,4/15/2021 0:00
2345,"Ether futures on CME hit new highs for volumes, open interest",https://www.tbstat.com/wp/uploads/2019/05/ethereum-testnets-800x450.jpg,https://coinmarketcal.com/en/news/ether-futures-on-cme-hit-new-highs-for-volumes-open-interest,15-Apr-21,4/15/2021 0:00
2346,"Coinbase, Ledger, and other crypto services impacted by client sync issue following Ethereum’s Berlin hard fork",https://www.tbstat.com/wp/uploads/2021/04/20210409_Ethereum_Generic-800x450.jpg,https://coinmarketcal.com/en/news/coinbase-ledger-and-other-crypto-services-impacted-by-client-sync-issue-following-ethereums-berlin-hard-fork,15-Apr-21,4/15/2021 0:00
2347,Cathie Wood’s Ark funds bought $246 million worth-of Coinbase stocks on listing debut,https://www.tbstat.com/wp/uploads/2021/01/20210126_coinbase_C-Daily-800x450.jpg,https://coinmarketcal.com/en/news/cathie-woods-ark-funds-bought-246-million-worth-of-coinbase-stocks-on-listing-debut,15-Apr-21,4/15/2021 0:00
2348,Insurance giant AXA Switzerland now allows customers to pay premiums in bitcoin,https://www.tbstat.com/wp/uploads/2020/07/20200717_Bitcoin-Volatility-800x450.jpg,https://coinmarketcal.com/en/news/insurance-giant-axa-switzerland-now-allows-customers-to-pay-premiums-in-bitcoin,15-Apr-21,4/15/2021 0:00
2349,"Chinese police arrest EOS gambling dApp team, seize $3.8 million in crypto",https://www.tbstat.com/wp/uploads/2020/12/20201210_China_Plus_Token-Daily-800x450.png,https://coinmarketcal.com/en/news/chinese-police-arrest-eos-gambling-dapp-team-seize-3-8-million-in-crypto,15-Apr-21,4/15/2021 0:00
2350,Edward Snowden is auctioning off a non-fungible token to benefit the Freedom of the Press Foundation,https://www.tbstat.com/wp/uploads/2021/04/nft-excerpt.original-798x450.png,https://coinmarketcal.com/en/news/edward-snowden-is-auctioning-off-a-non-fungible-token-to-benefit-the-freedom-of-the-press-foundation,15-Apr-21,4/15/2021 0:00
2351,Coinbase’s first day on Nasdaq ends with an $85.7 billion valuation,https://www.tbstat.com/wp/uploads/2021/02/20210225_Coinbase_Gen-4-800x450.jpg,https://coinmarketcal.com/en/news/coinbases-first-day-on-nasdaq-ends-with-an-85-7-billion-valuation,14-Apr-21,4/14/2021 0:00
2352,"Crypto unicorn Coinbase’s shares begin trading on Nasdaq, price shoots above $400",https://www.tbstat.com/wp/uploads/2021/01/20210126_coinbase_L-Daily-800x450.jpg,https://coinmarketcal.com/en/news/crypto-unicorn-coinbases-shares-begin-trading-on-nasdaq-price-shoots-above-400,14-Apr-21,4/14/2021 0:00
2353,US Senate confirms Gary Gensler as Joe Biden’s SEC chairman,https://www.tbstat.com/wp/uploads/2020/11/20201113_GaryGensler-Daily-800x450.jpg,https://coinmarketcal.com/en/news/us-senate-confirms-gary-gensler-as-joe-bidens-sec-chairman,14-Apr-21,4/14/2021 0:00
2354,Goldman Sachs CEO talks bitcoin and cryptocurrency during earnings call,https://www.tbstat.com/wp/uploads/2019/07/Goldman-Sachs-800x450.jpg,https://coinmarketcal.com/en/news/goldman-sachs-ceo-talks-bitcoin-and-cryptocurrency-during-earnings-call,14-Apr-21,4/14/2021 0:00
2355,Indicative price of $340 set for Coinbase share after Nasdaq quotation window: source,https://www.tbstat.com/wp/uploads/2021/02/20210225_Coinbase_Gen-3-800x450.jpg,https://coinmarketcal.com/en/news/indicative-price-of-340-set-for-coinbase-share-after-nasdaq-quotation-window-source,14-Apr-21,4/14/2021 0:00
2356,F2Pool encodes Biden stimulus headline to mark Coinbase’s direct listing on Nasdaq,https://www.tbstat.com/wp/uploads/2021/04/Screen-Shot-2021-04-14-at-10.08.51-PM-1-800x403.png,https://coinmarketcal.com/en/news/f2pool-encodes-biden-stimulus-headline-to-mark-coinbases-direct-listing-on-nasdaq,14-Apr-21,4/14/2021 0:00
2357,VanEck launches new ETF on Nasdaq to offer exposure to digital asset-focused companies,https://www.tbstat.com/wp/uploads/2021/02/20210219_Bitcoin_ETF_Generic-800x450.jpg,https://coinmarketcal.com/en/news/vaneck-launches-new-etf-on-nasdaq-to-offer-exposure-to-digital-asset-focused-companies,14-Apr-21,4/14/2021 0:00
2358,Coinbase CEO expects 50% of company’s future revenues to come from non-trading businesses,https://www.tbstat.com/wp/uploads/2020/09/Coinbase_Ceo_Blog-Daily_2-800x450.jpg,https://coinmarketcal.com/en/news/coinbase-ceo-expects-50-of-companys-future-revenues-to-come-from-non-trading-businesses,14-Apr-21,4/14/2021 0:00
2359,"The Coinbase direct listing: What you should expect, according to Nasdaq’s IPO impresario",https://www.tbstat.com/wp/uploads/2021/04/20210413_Nasdaq_Coinbase-800x450.jpg,https://coinmarketcal.com/en/news/the-coinbase-direct-listing-what-you-should-expect-according-to-nasdaqs-ipo-impresario,14-Apr-21,4/14/2021 0:00
2360,Binance to list Coinbase stock token today,https://www.tbstat.com/wp/uploads/2021/01/20210126_coinbase_L-Daily-800x450.jpg,https://coinmarketcal.com/en/news/binance-to-list-coinbase-stock-token-today,14-Apr-21,4/14/2021 0:00
2361,Filmmaker Kevin Smith to release new horror film anthology as NFT,https://www.tbstat.com/wp/uploads/2021/04/shutterstock_1258935331-675x450.jpg,https://coinmarketcal.com/en/news/filmmaker-kevin-smith-to-release-new-horror-film-anthology-as-nft,13-Apr-21,4/13/2021 0:00
2362,SEC commissioner Hester Peirce unveils updated version of ‘safe harbor’ proposal for crypto tokens,https://www.tbstat.com/wp/uploads/2019/06/sec-filter-2-800x450.jpg,https://coinmarketcal.com/en/news/sec-commissioner-hester-peirce-unveils-updated-version-of-safe-harbor-proposal-for-crypto-tokens,13-Apr-21,4/13/2021 0:00
2363,Enso raises $5 million to build decentralized social trading platform,https://www.tbstat.com/wp/uploads/2019/04/polychain-800x450.jpg,https://coinmarketcal.com/en/news/enso-raises-5-million-to-build-decentralized-social-trading-platform,13-Apr-21,4/13/2021 0:00
2364,Nasdaq sets initial reference price for Coinbase’s stock at $250,https://www.tbstat.com/wp/uploads/2021/02/20210225_Coinbase_Gen-4-800x450.jpg,https://coinmarketcal.com/en/news/nasdaq-sets-initial-reference-price-for-coinbases-stock-at-250,13-Apr-21,4/13/2021 0:00
2365,"ConsenSys closes $65 million funding round backed by JPMorgan, Mastercard and more",https://www.tbstat.com/wp/uploads/2018/11/consensys-800x450.jpg,https://coinmarketcal.com/en/news/consensys-closes-65-million-funding-round-backed-by-jpmorgan-mastercard-and-more,13-Apr-21,4/13/2021 0:00
2366,HSBC confirms banning customers from buying MicroStrategy shares due to bitcoin concerns,https://www.tbstat.com/wp/uploads/2021/04/hsbc-674x450.jpeg,https://coinmarketcal.com/en/news/hsbc-confirms-banning-customers-from-buying-microstrategy-shares-due-to-bitcoin-concerns,13-Apr-21,4/13/2021 0:00
