key,news,img,link,date_str,date_parsed
735,Blockademia Announces Partnership With Mercuri International Croatia,https://d32bfp67k1q0s7.cloudfront.net/d8776fa165644ab3571f49ef47df4b63.png,https://coinmarketcal.com/en/news/blockademia-announces-partnership-with-mercuri-international-croatia,30-Nov-21,11/30/2021 0:00
736,"Joining Pangolin V2's First Liquidity Pools, TrueUSD Takes the Growth of Avalanche to the Next Level",https://d32bfp67k1q0s7.cloudfront.net/de2fb88e6a8b369e56aeaa8d43236b1a.png,https://coinmarketcal.com/en/news/joining-pangolin-v2s-first-liquidity-pools-trueusd-takes-the-growth-of-avalanche-to-the-next-level,30-Nov-21,11/30/2021 0:00
737,Cold Staking and PoS Staking Comparison,https://i.ibb.co/VYjj5Jm/Cold-Staking.jpg,https://coinmarketcal.com/en/news/cold-staking-and-pos-staking-comparison,30-Nov-21,11/30/2021 0:00
738,Student Coin Created an Exclusive Group for the TOP 100 STC holders,https://coincal.zendesk.com/attachments/token/AMEy6sVsnWtVBoy6Ezj15Rimb/?name=1_bb4XCl-bai382eswGSgFBw.png,https://coinmarketcal.com/en/news/student-coin-created-an-exclusive-group-for-the-top-100-stc-holders,30-Nov-21,11/30/2021 0:00
739,6th International Exchange Agreement From Bitci Technology: B?TC?COIN WILL BE ON BITTREX GLOBAL ON DECEMBER 3,https://i.ibb.co/7v14hK8/photo-2021-11-30-09-44-51.jpg,https://coinmarketcal.com/en/news/6th-international-exchange-agreement-from-bitci-technology-bitcicoin-will-be-on-bittrex-global-on-december-3,30-Nov-21,11/30/2021 0:00
740,Introducing ADADAO — World’s First interest-free stablecoin protocol,https://miro.medium.com/max/1400/1*jcXigUPCRgcoH6uCSZ_b6w.png,https://coinmarketcal.com/en/news/introducing-adadao-worlds-first-interest-free-stablecoin-protocol,30-Nov-21,11/30/2021 0:00
741,Kelly ETFs files for Ether futures ETF,https://www.tbstat.com/wp/uploads/2021/09/20210917_Ethereum_General-800x450.jpg,https://coinmarketcal.com/en/news/kelly-etfs-files-for-ether-futures-etf,29-Nov-21,11/29/2021 0:00
742,Mapping out the Polkadot ecosystem,https://www.tbstat.com/wp/uploads/2021/11/20211105_Polkadot_Map-Research-800x450.jpg,https://coinmarketcal.com/en/news/mapping-out-the-polkadot-ecosystem,29-Nov-21,11/29/2021 0:00
743,"Smart Contracts Start Transferring ICP After Upgrade, Allowing Advanced DeFi To Be Developed On The Internet Computer",https://d32bfp67k1q0s7.cloudfront.net/0e5a0a804108fe493d367e0b932afad1.png,https://coinmarketcal.com/en/news/smart-contracts-start-transferring-icp-after-upgrade-allowing-advanced-defi-to-be-developed-on-the-internet-computer,29-Nov-21,11/29/2021 0:00
744,SAVAGE IDO Is Set to Launch on OccamRazer and FantomStarter on December 15,https://d32bfp67k1q0s7.cloudfront.net/51c1ca6dbffd948001dc6a040a306de6.png,https://coinmarketcal.com/en/news/savage-ido-is-set-to-launch-on-occamrazer-and-fantomstarter-on-december-15,29-Nov-21,11/29/2021 0:00
745,Twitter names Parag Agrawal CEO as Jack Dorsey steps down,https://www.tbstat.com/wp/uploads/2021/07/20210707_Twitter_NFT-800x450.jpg,https://coinmarketcal.com/en/news/twitter-names-parag-agrawal-ceo-as-jack-dorsey-steps-down,29-Nov-21,11/29/2021 0:00
746,Former Wall Street banker launches $1.5 billion crypto venture fund,https://www.tbstat.com/wp/uploads/2021/10/20211015_Funding_General_3-800x450.jpg,https://coinmarketcal.com/en/news/former-wall-street-banker-launches-1-5-billion-crypto-venture-fund,29-Nov-21,11/29/2021 0:00
747,Popular Ethereum mixer Tornado Cash is ready to integrate with Arbitrum,https://www.tbstat.com/wp/uploads/2021/04/20210409_Ethereum_Generic-800x450.jpg,https://coinmarketcal.com/en/news/popular-ethereum-mixer-tornado-cash-is-ready-to-integrate-with-arbitrum,29-Nov-21,11/29/2021 0:00
748,MicroStrategy buys more bitcoin for over $414 million in cash,https://www.tbstat.com/wp/uploads/2020/09/20200923_Michael_Saylor_Bitcoin-Daily-800x450.jpg,https://coinmarketcal.com/en/news/microstrategy-buys-more-bitcoin-for-over-414-million-in-cash,29-Nov-21,11/29/2021 0:00
749,SK Telecom spinoff acquires 35% stake in South Korean crypto exchange giant Korbit,https://www.tbstat.com/wp/uploads/2019/06/south-korea-flag-building-800x450.jpg,https://coinmarketcal.com/en/news/sk-telecom-spinoff-acquires-35-stake-in-south-korean-crypto-exchange-giant-korbit,29-Nov-21,11/29/2021 0:00
750,3 coins to keep an eye on | Issue #158,https://bucket.mlcdn.com/a/1227/1227214/images/f4b39eec53268047d162afba8394a6cab89e6604.png,https://coinmarketcal.com/en/news/3-coins-to-keep-an-eye-on-issue-158,29-Nov-21,11/29/2021 0:00
751,Bank of France official: Existing regulatory frameworks ‘constrained’ by DeFi characteristics,https://www.tbstat.com/wp/uploads/2019/07/france-flag-french-800x450.jpg,https://coinmarketcal.com/en/news/bank-of-france-official-existing-regulatory-frameworks-constrained-by-defi-characteristics,28-Nov-21,11/28/2021 0:00
752,Decentralized exchanges near $100 billion in monthly volume for November,https://www.tbstat.com/wp/uploads/2021/01/20210126_Defi_Gen-Daily-800x450.png,https://coinmarketcal.com/en/news/decentralized-exchanges-near-100-billion-in-monthly-volume-for-november,28-Nov-21,11/28/2021 0:00
753,"QANplatform (QANX), the quantum-resistant blockchain platform launches its CEX listing journey on Gate.io",https://d32bfp67k1q0s7.cloudfront.net/2bfe568bb508209be0acbf38828314ed.png,https://coinmarketcal.com/en/news/qanplatform-qanx-the-quantum-resistant-blockchain-platform-launches-its-cex-listing-journey-on-gate-io,28-Nov-21,11/28/2021 0:00
754,"Hacked cloud accounts are being used to mine crypto, says Google",https://www.tbstat.com/wp/uploads/2020/09/Crypto_Google_Scams-800x450.jpg,https://coinmarketcal.com/en/news/hacked-cloud-accounts-are-being-used-to-mine-crypto-says-google,27-Nov-21,11/27/2021 0:00
755,Astra Guild Ventures Declares It's Private Sale,https://d32bfp67k1q0s7.cloudfront.net/c430fcc89949716043634f6dbf65090d.png,https://coinmarketcal.com/en/news/astra-guild-ventures-declares-its-private-sale,27-Nov-21,11/27/2021 0:00
756,"The IEO for $CODI, the native token of the CODI Ecosystem, is now live.",https://i.ibb.co/s9snqkz/ieo-4.jpg,https://coinmarketcal.com/en/news/the-ieo-for-codi-the-native-token-of-the-codi-ecosystem-is-now-live,27-Nov-21,11/27/2021 0:00
757,Celsius says ’employee’ suspended amid rumors of CFO arrest in Israel,https://www.tbstat.com/wp/uploads/2019/08/cesius-us-800x450.jpg,https://coinmarketcal.com/en/news/celsius-says-employee-suspended-amid-rumors-of-cfo-arrest-in-israel,26-Nov-21,11/26/2021 0:00
758,"Department of Veterans Affairs seeks contractor info on blockchain use for data sharing, supply chain optimizing",https://www.tbstat.com/wp/uploads/2021/11/VA-675x450.jpg,https://coinmarketcal.com/en/news/department-of-veterans-affairs-seeks-contractor-info-on-blockchain-use-for-data-sharing-supply-chain-optimizing,26-Nov-21,11/26/2021 0:00
759,Tanzania has begun preparations to launch its own central bank digital currency,https://www.tbstat.com/wp/uploads/2021/11/shutterstock_1846392034-675x450.jpg,https://coinmarketcal.com/en/news/tanzania-has-begun-preparations-to-launch-its-own-central-bank-digital-currency,26-Nov-21,11/26/2021 0:00
760,Crypto data firm DappRadar set to launch its own token,https://www.tbstat.com/wp/uploads/2021/08/20210818_War_On_Stablecoins-800x450.jpg,https://coinmarketcal.com/en/news/crypto-data-firm-dappradar-set-to-launch-its-own-token,26-Nov-21,11/26/2021 0:00
761,KingSpeed Reveals Huge Backers Following A Successful Private Round of $1.2 Million,https://d32bfp67k1q0s7.cloudfront.net/4afeb1081d635909ef3e1911219d52d6.png,https://coinmarketcal.com/en/news/kingspeed-reveals-huge-backers-following-a-successful-private-round-of-1-2-million,26-Nov-21,11/26/2021 0:00
762,Play-to-Earn gaming guilds,https://www.tbstat.com/wp/uploads/2021/11/211109_Gaming-Guild_Research_lr-800x450.jpg,https://coinmarketcal.com/en/news/play-to-earn-gaming-guilds,26-Nov-21,11/26/2021 0:00
763,"Planet Fashion Launches Functional NFTs For Fashionistas, Including Luxury All-Inclusive Travel To Monaco Swim Week & The Monaco Grand Prix",https://d32bfp67k1q0s7.cloudfront.net/1c9997b04ac9bb3f98537b73e6a23a71.png,https://coinmarketcal.com/en/news/planet-fashion-launches-functional-nfts-for-fashionistas-including-luxury-all-inclusive-travel-to-monaco-swim-week-the-monaco-gr,26-Nov-21,11/26/2021 0:00
764,Flurry Finance deploys on Polygon after hitting $3 million TVL in just a month of launch,https://d32bfp67k1q0s7.cloudfront.net/102fba03fc4790d9b8765bdf2abce7c7.png,https://coinmarketcal.com/en/news/flurry-finance-deploys-on-polygon-after-hitting-3-million-tvl-in-just-a-month-of-launch,26-Nov-21,11/26/2021 0:00
765,China’s crypto censorship reaches over news outlets and mining pools,https://www.tbstat.com/wp/uploads/2019/12/20191206_China-Analysis-Daily-800x450.jpg,https://coinmarketcal.com/en/news/chinas-crypto-censorship-reaches-over-news-outlets-and-mining-pools,26-Nov-21,11/26/2021 0:00
766,Current state of DeFi in 2021: Part 1,https://www.tbstat.com/wp/uploads/2021/11/20211124_DeFi_Research_2021_-800x450.jpg,https://coinmarketcal.com/en/news/current-state-of-defi-in-2021-part-1,25-Nov-21,11/25/2021 0:00
767,The story behind a massive bitcoin mining heist in China,https://www.tbstat.com/wp/uploads/2021/08/20210809_NA_Miners_Surge-797x450.jpg,https://coinmarketcal.com/en/news/the-story-behind-a-massive-bitcoin-mining-heist-in-china,25-Nov-21,11/25/2021 0:00
768,Hillary Clinton wants crypto regulation to protect the dollar’s reserve status,https://www.tbstat.com/wp/uploads/2021/05/20210526_Revolving-Door-Crypto-Regulation-800x450.jpg,https://coinmarketcal.com/en/news/hillary-clinton-wants-crypto-regulation-to-protect-the-dollars-reserve-status,25-Nov-21,11/25/2021 0:00
769,"English and Welsh law can apply to smart contracts, says Law Commission",https://www.tbstat.com/wp/uploads/2020/11/20201117_law-Daily-800x450.jpg,https://coinmarketcal.com/en/news/english-and-welsh-law-can-apply-to-smart-contracts-says-law-commission,25-Nov-21,11/25/2021 0:00
770,Axie Infinity plot of virtual land sells for record $2.4 million,https://www.tbstat.com/wp/uploads/2021/07/20210729_Axie-Infinity-800x450.jpg,https://coinmarketcal.com/en/news/axie-infinity-plot-of-virtual-land-sells-for-record-2-4-million,25-Nov-21,11/25/2021 0:00
771,Adidas Originals announces partnership with Coinbase,https://www.tbstat.com/wp/uploads/2021/11/shutterstock_1027986541-674x450.jpg,https://coinmarketcal.com/en/news/adidas-originals-announces-partnership-with-coinbase,25-Nov-21,11/25/2021 0:00
772,MoonPay has quietly set up a concierge service to help celebrities buy NFTs,https://www.tbstat.com/wp/uploads/2021/11/Bored-Ape-599-original-1-800x450.png,https://coinmarketcal.com/en/news/moonpay-has-quietly-set-up-a-concierge-service-to-help-celebrities-buy-nfts,25-Nov-21,11/25/2021 0:00
773,Council of the European Union moves forward on two crypto proposals,https://www.tbstat.com/wp/uploads/2021/07/Behind-the-Scenes-of-EU-Crypto-Reg-IMAGE-675x450.jpeg,https://coinmarketcal.com/en/news/council-of-the-european-union-moves-forward-on-two-crypto-proposals,25-Nov-21,11/25/2021 0:00
774,Hector DAO Brings a New Era of Decentralization Replace Centralized Stablecoins,https://btcmanager.com/wp-content/uploads/2021/11/Hector-DAO-Brings-a-New-Era-of-Decentralization-Replace-Centralized-Stablecoins.jpg,https://coinmarketcal.com/en/news/hector-dao-brings-a-new-era-of-decentralization-replace-centralized-stablecoins,25-Nov-21,11/25/2021 0:00
775,"MIXMOB, a Play-to-Earn Game Powered by Solana, Developed by Veterans From FIFA, PokerStars, Halo, Nintendo & More.",https://d32bfp67k1q0s7.cloudfront.net/b8cea10906157f8d909f0b717ba3c03e.png,https://coinmarketcal.com/en/news/mixmob-a-play-to-earn-game-powered-by-solana-developed-by-veterans-from-fifa-pokerstars-halo-nintendo-more,25-Nov-21,11/25/2021 0:00
776,"MonoX, profitable since mainnet launch, announces its public token sale on Huobi Primelist",https://d32bfp67k1q0s7.cloudfront.net/2e0fce2ff006352d52264cc88cccb6ba.png,https://coinmarketcal.com/en/news/monox-profitable-since-mainnet-launch-announces-its-public-token-sale-on-huobi-primelist,25-Nov-21,11/25/2021 0:00
777,Panther Protocol Raises $22 million in Public Sale  to Build Interoperable Privacy Layer for DeFi and Web3,https://d32bfp67k1q0s7.cloudfront.net/7c9250283423c0b73ebfa7b36ea5decc.png,https://coinmarketcal.com/en/news/panther-protocol-raises-22-million-in-public-sale-to-build-interoperable-privacy-layer-for-defi-and-web3,25-Nov-21,11/25/2021 0:00
778,ELI5 the Ethereum Merge,https://www.tbstat.com/wp/uploads/2021/11/211123_Ethereum_Merge_Research-800x450.jpg,https://coinmarketcal.com/en/news/eli5-the-ethereum-merge,24-Nov-21,11/24/2021 0:00
779,Coinbase acquires crypto wallet startup BRD,https://www.tbstat.com/wp/uploads/2021/02/20210225_Coinbase_Gen-4-800x450.jpg,https://coinmarketcal.com/en/news/coinbase-acquires-crypto-wallet-startup-brd,24-Nov-21,11/24/2021 0:00
780,More than 1 million ETH has been burned following EIP-1559,https://www.tbstat.com/wp/uploads/2021/04/20210409_Ethereum_Generic-800x450.jpg,https://coinmarketcal.com/en/news/more-than-1-million-eth-has-been-burned-following-eip-1559,24-Nov-21,11/24/2021 0:00
781,Blockchain gaming guild Avocado raises $18 million from Solana Ventures and others,https://www.tbstat.com/wp/uploads/2021/10/20211015_Funding_General_3-800x450.jpg,https://coinmarketcal.com/en/news/blockchain-gaming-guild-avocado-raises-18-million-from-solana-ventures-and-others,24-Nov-21,11/24/2021 0:00
782,Bitcoin trades at over 3% discount in India after government lists a crypto bill in Parliament for discussion,https://www.tbstat.com/wp/uploads/2021/04/20210402_Bitcoin_Generic-800x450.jpg,https://coinmarketcal.com/en/news/bitcoin-trades-at-over-3-discount-in-india-after-government-lists-a-crypto-bill-in-parliament-for-discussion,24-Nov-21,11/24/2021 0:00
783,Kryxivia Offers Blockchain Gaming With an NFT-Powered Twist Incubated On Unicrypt,https://d32bfp67k1q0s7.cloudfront.net/b02ae0cfc836261d5bac3be7c0e9f79f.png,https://coinmarketcal.com/en/news/kryxivia-offers-blockchain-gaming-with-an-nft-powered-twist-incubated-on-unicrypt,24-Nov-21,11/24/2021 0:00
784,Haven Protocol Partners up with Edge Network for Web3 Relaunch,https://d32bfp67k1q0s7.cloudfront.net/0bf7adee39d38cab79a50eeffab7ab13.png,https://coinmarketcal.com/en/news/haven-protocol-partners-up-with-edge-network-for-web3-relaunch,24-Nov-21,11/24/2021 0:00
785,Does Your Crypto Exchange Live up to These 5 Requirements?,https://coinmarketcal.com/images/coinmarketcal-placeholder.jpg,https://coinmarketcal.com/en/news/does-your-crypto-exchange-live-up-to-these-5-requirements,24-Nov-21,11/24/2021 0:00
786,"Senate Banking Committee chair seeks answers on stablecoins from Tether, Centre, Paxos and more",https://www.tbstat.com/wp/uploads/2021/08/20210818_War_On_Stablecoins-800x450.jpg,https://coinmarketcal.com/en/news/senate-banking-committee-chair-seeks-answers-on-stablecoins-from-tether-centre-paxos-and-more,23-Nov-21,11/23/2021 0:00
787,Canadian investment company buys $2.5 million worth of virtual real estate in Decentraland,https://www.tbstat.com/wp/uploads/2021/11/20211111_Metaverse-800x450.jpg,https://coinmarketcal.com/en/news/canadian-investment-company-buys-2-5-million-worth-of-virtual-real-estate-in-decentraland,23-Nov-21,11/23/2021 0:00
788,"eToro to delist ADA, TRX for US users over regulatory concerns",https://www.tbstat.com/wp/uploads/2019/08/etoro-800x450.jpg,https://coinmarketcal.com/en/news/etoro-to-delist-ada-trx-for-us-users-over-regulatory-concerns,23-Nov-21,11/23/2021 0:00
789,Fold launches Pokémon GO-like game that rewards players in bitcoin,https://www.tbstat.com/wp/uploads/2021/05/20210526_Bitcoin_Developer_Generic-800x450.jpg,https://coinmarketcal.com/en/news/fold-launches-pokemon-go-like-game-that-rewards-players-in-bitcoin,23-Nov-21,11/23/2021 0:00
790,"OlympusDAO mistake lets user spend $50,000 to buy $1.43 million in OHM",https://www.tbstat.com/wp/uploads/2021/05/20210511_Hack-Phishing-Security-2-800x450.jpg,https://coinmarketcal.com/en/news/olympusdao-mistake-lets-user-spend-50-000-to-buy-1-43-million-in-ohm,23-Nov-21,11/23/2021 0:00
791,US banking regulators plan to publish crypto guidance throughout 2022,https://www.tbstat.com/wp/uploads/2020/04/20200421-Central-Bank-Daily-800x450.jpg,https://coinmarketcal.com/en/news/us-banking-regulators-plan-to-publish-crypto-guidance-throughout-2022,23-Nov-21,11/23/2021 0:00
792,Indian government is expected to introduce a crypto bill in Parliament,https://www.tbstat.com/wp/uploads/2021/03/20210302_India_Crypto_Future-800x450.jpg,https://coinmarketcal.com/en/news/indian-government-is-expected-to-introduce-a-crypto-bill-in-parliament,23-Nov-21,11/23/2021 0:00
793,IMF warns El Salvador of bitcoin-related risks in new statement,https://www.tbstat.com/wp/uploads/2019/09/shutterstock_1276403380-635x450.jpg,https://coinmarketcal.com/en/news/imf-warns-el-salvador-of-bitcoin-related-risks-in-new-statement,23-Nov-21,11/23/2021 0:00
794,Bitcoin miner GRIID nets $525 million loan from Blockchain.com to bolster mining operations,https://www.tbstat.com/wp/uploads/2021/02/20210216_Mining_Bitcoin_2_Generic-800x450.jpg,https://coinmarketcal.com/en/news/bitcoin-miner-griid-nets-525-million-loan-from-blockchain-com-to-bolster-mining-operations,22-Nov-21,11/22/2021 0:00
795,"a16z, The Chainsmokers back 3LAU’s NFT platform Royal in $55 million Series A",https://www.tbstat.com/wp/uploads/2019/07/money-2-alt-800x450.jpg,https://coinmarketcal.com/en/news/a16z-the-chainsmokers-back-3laus-nft-platform-royal-in-55-million-series-a,22-Nov-21,11/22/2021 0:00
796,Citigroup appoints new head of digital assets for institutional clients as it eyes up to 100 new hires,https://www.tbstat.com/wp/uploads/2019/09/shutterstock_284495540-674x450.jpg,https://coinmarketcal.com/en/news/citigroup-appoints-new-head-of-digital-assets-for-institutional-clients-as-it-eyes-up-to-100-new-hires,22-Nov-21,11/22/2021 0:00
797,ECB extends PISA framework to cover crypto and electronic wallets,https://www.tbstat.com/wp/uploads/2019/01/ECB-600x450.jpg,https://coinmarketcal.com/en/news/ecb-extends-pisa-framework-to-cover-crypto-and-electronic-wallets,22-Nov-21,11/22/2021 0:00
798,Victims and investors are sitting on a trove of Mt Gox claims. Now they’re set to make bank.,https://www.tbstat.com/wp/uploads/2021/11/211119_Mt_Gox6-800x450.jpg,https://coinmarketcal.com/en/news/victims-and-investors-are-sitting-on-a-trove-of-mt-gox-claims-now-theyre-set-to-make-bank,22-Nov-21,11/22/2021 0:00
799,"Biden re-nominates Powell as Fed chair, with Brainard as vice chair",https://www.tbstat.com/wp/uploads/2019/07/Joe-Biden-2-800x450.jpg,https://coinmarketcal.com/en/news/biden-re-nominates-powell-as-fed-chair-with-brainard-as-vice-chair,22-Nov-21,11/22/2021 0:00
800,Crypto payments service MoonPay raises $555 million from Coatue and Tiger,https://www.tbstat.com/wp/uploads/2021/11/Ivan-Soto-Wright-675x450.jpg,https://coinmarketcal.com/en/news/crypto-payments-service-moonpay-raises-555-million-from-coatue-and-tiger,22-Nov-21,11/22/2021 0:00
801,Crypto lender Celsius increases Bitcoin mining investment to $500 million,https://www.tbstat.com/wp/uploads/2021/10/211019_Crypto_Bitcoin_Mining_General2-800x450.jpg,https://coinmarketcal.com/en/news/crypto-lender-celsius-increases-bitcoin-mining-investment-to-500-million,22-Nov-21,11/22/2021 0:00
802,3 coins to keep an eye on | Issue #157,https://bucket.mlcdn.com/a/1227/1227214/images/8733e19001acfb6367d34c900a7bcf5d26823afc.png,https://coinmarketcal.com/en/news/3-coins-to-keep-an-eye-on-issue-157,22-Nov-21,11/22/2021 0:00
803,"El Salvador government strikes deal with Bitfinex, Blockstream to issue $1 billion bitcoin bond",https://www.tbstat.com/wp/uploads/2021/06/20210628_El_Salvador_Generic-800x450.png,https://coinmarketcal.com/en/news/el-salvador-government-strikes-deal-with-bitfinex-blockstream-to-issue-1-billion-bitcoin-bond,21-Nov-21,11/21/2021 0:00
804,How to Prevent Hype from Influencing your Crypto Investment Decisions?,https://i.ibb.co/Xk79S01/Screenshot-2021-11-21-at-09-44-27.png,https://coinmarketcal.com/en/news/how-to-prevent-hype-from-influencing-your-crypto-investment-decisions,20-Nov-21,11/20/2021 0:00
805,"Square unveils white paper for decentralized protocol that lets you exchange bitcoin, fiat and more",https://www.tbstat.com/wp/uploads/2021/07/20210723_jack_Dorsey-800x450.jpg,https://coinmarketcal.com/en/news/square-unveils-white-paper-for-decentralized-protocol-that-lets-you-exchange-bitcoin-fiat-and-more,19-Nov-21,11/19/2021 0:00
806,Citadel founder Kenneth Griffin beat crypto group in US Constitution copy auction: report,https://www.tbstat.com/wp/uploads/2019/02/auction-1-800x450.jpg,https://coinmarketcal.com/en/news/citadel-founder-kenneth-griffin-beat-crypto-group-in-us-constitution-copy-auction-report,19-Nov-21,11/19/2021 0:00
807,A look at how Cosmos is enabling swaps between blockchains,https://www.tbstat.com/wp/uploads/2021/11/11172021_Cosmos_Swap_2-800x450.jpg,https://coinmarketcal.com/en/news/a-look-at-how-cosmos-is-enabling-swaps-between-blockchains,19-Nov-21,11/19/2021 0:00
808,Snapshot Labs raises $4 million in seed funding to build DAO governance solutions,https://www.tbstat.com/wp/uploads/2021/11/2021118_All_in_one_DAO-800x450.png,https://coinmarketcal.com/en/news/snapshot-labs-raises-4-million-in-seed-funding-to-build-dao-governance-solutions,19-Nov-21,11/19/2021 0:00
809,Binance integrates Ethereum Layer 2 network Arbitrum One,https://www.tbstat.com/wp/uploads/2021/07/20210720_Binance_generic_1-800x450.jpg,https://coinmarketcal.com/en/news/binance-integrates-ethereum-layer-2-network-arbitrum-one,19-Nov-21,11/19/2021 0:00
810,Solana Labs CEO: It ‘doesn’t really matter’ if the network goes down again,https://www.tbstat.com/wp/uploads/2019/07/solana-800x450.jpg,https://coinmarketcal.com/en/news/solana-labs-ceo-it-doesnt-really-matter-if-the-network-goes-down-again,19-Nov-21,11/19/2021 0:00
811,Mastercard EVP Jess Turner on becoming a ‘crypto first’ company,https://www.tbstat.com/wp/uploads/2021/11/20211116_TheScoop_Jess_Turner_16x9-800x450.jpg,https://coinmarketcal.com/en/news/mastercard-evp-jess-turner-on-becoming-a-crypto-first-company,19-Nov-21,11/19/2021 0:00
812,Crypto group loses bid to buy rare US Constitution copy in ‘record breaking’ Sotheby’s auction,https://www.tbstat.com/wp/uploads/2021/11/Webp.net-resizeimage14-800x450.jpg,https://coinmarketcal.com/en/news/crypto-group-loses-bid-to-buy-rare-us-constitution-copy-in-record-breaking-sothebys-auction,19-Nov-21,11/19/2021 0:00
813,FUNToken Brings Unique Value Proposition to Visitors and Participants at SiGMA Europe 2021,https://i.ibb.co/YZHFrg8/photo-2021-11-18-22-26-56.jpg,https://coinmarketcal.com/en/news/funtoken-brings-unique-value-proposition-to-visitors-and-participants-at-sigma-europe-2021,19-Nov-21,11/19/2021 0:00
814,Peachfolio DeFi price alerts go live!,https://coinmarketcal.com/images/coinmarketcal-placeholder.jpg,https://coinmarketcal.com/en/news/peachfolio-defi-price-alerts-go-live,19-Nov-21,11/19/2021 0:00
815,The Impact of Blockchain and Bitcoin on Gaming,https://i.ibb.co/mD3tfKR/Screenshot-2021-11-21-at-09-45-05.png,https://coinmarketcal.com/en/news/the-impact-of-blockchain-and-bitcoin-on-gaming,19-Nov-21,11/19/2021 0:00
816,Bitcoin’s Wild Ride and the Year Ahead,https://i.ibb.co/NtTh8hS/Screenshot-2021-11-21-at-09-44-38.png,https://coinmarketcal.com/en/news/bitcoins-wild-ride-and-the-year-ahead,19-Nov-21,11/19/2021 0:00
817,Crypto asset manager plans to raise hundreds of millions to actively invest in NFTs,https://www.tbstat.com/wp/uploads/2019/07/money-stacks-800x450.jpg,https://coinmarketcal.com/en/news/crypto-asset-manager-plans-to-raise-hundreds-of-millions-to-actively-invest-in-nfts,18-Nov-21,11/18/2021 0:00
818,The startup that developed El Salvador’s bitcoin wallets and ATMs is taking the product global,https://www.tbstat.com/wp/uploads/2021/09/20210917_Chivo_ATM-800x450.jpg,https://coinmarketcal.com/en/news/the-startup-that-developed-el-salvadors-bitcoin-wallets-and-atms-is-taking-the-product-global,18-Nov-21,11/18/2021 0:00
819,Gemini valued at $7.1 billion in first funding round,https://www.tbstat.com/wp/uploads/2019/07/Winklevoss-Gemini-getty-800x450.jpg,https://coinmarketcal.com/en/news/gemini-valued-at-7-1-billion-in-first-funding-round,18-Nov-21,11/18/2021 0:00
820,Social platform Upstream is building a DAO-it-yourself kit,https://www.tbstat.com/wp/uploads/2021/11/2021118_All_in_one_DAO-800x450.png,https://coinmarketcal.com/en/news/social-platform-upstream-is-building-a-dao-it-yourself-kit,18-Nov-21,11/18/2021 0:00
821,Bitso unveils new stablecoin tool for Mexico-US payments,https://www.tbstat.com/wp/uploads/2020/12/20201208_Bitso_62m-Daily-800x450.jpg,https://coinmarketcal.com/en/news/bitso-unveils-new-stablecoin-tool-for-mexico-us-payments,18-Nov-21,11/18/2021 0:00
822,DeFi goes institutional: Maple Finance offers syndicated loans to Alameda Research,https://www.tbstat.com/wp/uploads/2021/01/20210126_Defi-Daily-800x450.png,https://coinmarketcal.com/en/news/defi-goes-institutional-maple-finance-offers-syndicated-loans-to-alameda-research,18-Nov-21,11/18/2021 0:00
823,DCG raises $600 million in debt capital raise,https://www.tbstat.com/wp/uploads/2020/12/20201221_DCG-Daily-800x450.jpg,https://coinmarketcal.com/en/news/dcg-raises-600-million-in-debt-capital-raise,18-Nov-21,11/18/2021 0:00
824,TIME Magazine partners with Galaxy to educate readers about the metaverse,https://www.tbstat.com/wp/uploads/2021/03/time-logo-og.png,https://coinmarketcal.com/en/news/time-magazine-partners-with-galaxy-to-educate-readers-about-the-metaverse,18-Nov-21,11/18/2021 0:00
