key,news,img,link,date_str,date_parsed
1464,Deep Dive: BFT Governance and SMV smart contracts,https://miro.medium.com/max/636/1*W_lgO0RiHErRjmHBfPJF_g.jpeg,https://coinmarketcal.com/en/news/deep-dive-bft-governance-and-smv-smart-contracts,26-Aug-21,8/26/2021 0:00
1465,This NFT project is literally putting poetry on the blockchain,https://www.tbstat.com/wp/uploads/2021/07/20210726_Ether_Poems-800x450.jpg,https://coinmarketcal.com/en/news/this-nft-project-is-literally-putting-poetry-on-the-blockchain,25-Aug-21,8/25/2021 0:00
1466,Solana-based data oracle Pyth Network is going live,https://www.tbstat.com/wp/uploads/2021/05/20210527_Solana_Generic_2-800x450.jpg,https://coinmarketcal.com/en/news/solana-based-data-oracle-pyth-network-is-going-live,25-Aug-21,8/25/2021 0:00
1467,Mark Cuban-backed startup that fuses AI with NFTs raises $16 million,https://www.tbstat.com/wp/uploads/2021/04/20210402_Funding_Generic-800x450.jpg,https://coinmarketcal.com/en/news/mark-cuban-backed-startup-that-fuses-ai-with-nfts-raises-16-million,25-Aug-21,8/25/2021 0:00
1468,David Marcus: Facebook and Novi are ‘definitely looking’ to integrate NFTs,https://www.tbstat.com/wp/uploads/2019/07/David-Marcus-3-getty-800x450.jpg,https://coinmarketcal.com/en/news/david-marcus-facebook-and-novi-are-definitely-looking-to-integrate-nfts,25-Aug-21,8/25/2021 0:00
1469,FCA notice says Binance is ‘not capable’ of being supervised: report,https://www.tbstat.com/wp/uploads/2021/07/shutterstock_1926147116-ai-800x450.jpg,https://coinmarketcal.com/en/news/fca-notice-says-binance-is-not-capable-of-being-supervised-report,25-Aug-21,8/25/2021 0:00
1470,Under the hood of StarkWare,https://www.tbstat.com/wp/uploads/2021/08/20210824_Starkware_Under_The_Hood-Research-797x450.jpg,https://coinmarketcal.com/en/news/under-the-hood-of-starkware,25-Aug-21,8/25/2021 0:00
1471,PROJECT INVERSE: PHASE 2.0,https://coinmarketcal-share.s3.eu-west-1.amazonaws.com/News/1_42N_VQszxPGeBVs8XwFRNQ.jpeg,https://coinmarketcal.com/en/news/project-inverse-phase-2-0,25-Aug-21,8/25/2021 0:00
1472,Celo architect Rene Reinsberg on how the upstart platform can widen access to DeFi,https://www.tbstat.com/wp/uploads/2021/08/20210824_Rene_Reinsberg_Celo-800x450.jpg,https://coinmarketcal.com/en/news/celo-architect-rene-reinsberg-on-how-the-upstart-platform-can-widen-access-to-defi,24-Aug-21,8/24/2021 0:00
1473,Citigroup is working with regulators to start trading bitcoin futures: report,https://www.tbstat.com/wp/uploads/2019/09/shutterstock_284495540-674x450.jpg,https://coinmarketcal.com/en/news/citigroup-is-working-with-regulators-to-start-trading-bitcoin-futures-report,24-Aug-21,8/24/2021 0:00
1474,MicroStrategy announces new bitcoin buy worth $177 million,https://www.tbstat.com/wp/uploads/2020/12/20201207_Microstrategy-Daily-800x450.jpg,https://coinmarketcal.com/en/news/microstrategy-announces-new-bitcoin-buy-worth-177-million,24-Aug-21,8/24/2021 0:00
1475,Paxos is rebranding its stablecoin from PAX to USDP,https://www.tbstat.com/wp/uploads/2020/12/20201216_Paxos_142m-Daily-800x450.png,https://coinmarketcal.com/en/news/paxos-is-rebranding-its-stablecoin-from-pax-to-usdp,24-Aug-21,8/24/2021 0:00
1476,"Crypto exchange Kraken donates $250,000 to teams building Ethereum 2.0",https://www.tbstat.com/wp/uploads/2020/09/20200915_Kraken_Wyoming-Daily_S-800x450.jpg,https://coinmarketcal.com/en/news/crypto-exchange-kraken-donates-250-000-to-teams-building-ethereum-2-0,24-Aug-21,8/24/2021 0:00
1477,Bitcoin mining soon to be 12% harder but US miners have already won big in Q3,https://www.tbstat.com/wp/uploads/2020/12/20201218_Bidding-Bitcoin-Mining-800x450.jpg,https://coinmarketcal.com/en/news/bitcoin-mining-soon-to-be-12-harder-but-us-miners-have-already-won-big-in-q3,24-Aug-21,8/24/2021 0:00
1478,A conversation with the artist behind Fortune’s NFT cover,https://www.tbstat.com/wp/uploads/2021/08/20210819_Pplpleaser-800x450.jpg,https://coinmarketcal.com/en/news/a-conversation-with-the-artist-behind-fortunes-nft-cover,23-Aug-21,8/23/2021 0:00
1479,a16z-backed content platform Substack begins accepting bitcoin payments,https://www.tbstat.com/wp/uploads/2021/06/20210601_Bitcoin_Generic-800x450.jpg,https://coinmarketcal.com/en/news/a16z-backed-content-platform-substack-begins-accepting-bitcoin-payments,23-Aug-21,8/23/2021 0:00
1480,"90 CryptoPunks get snapped up in one hour following Visa’s $150,000 purchase",https://www.tbstat.com/wp/uploads/2021/08/Screenshot-2021-08-23-at-13.14.511-800x450.jpg,https://coinmarketcal.com/en/news/90-cryptopunks-get-snapped-up-in-one-hour-following-visas-150-000-purchase,23-Aug-21,8/23/2021 0:00
1481,Visa buys a CryptoPunk as it takes first steps into ‘NFT commerce’,https://www.tbstat.com/wp/uploads/2019/07/visa-office-800x450.jpg,https://coinmarketcal.com/en/news/visa-buys-a-cryptopunk-as-it-takes-first-steps-into-nft-commerce,23-Aug-21,8/23/2021 0:00
1482,NFT unicorn OpenSea sets sights on improving customer experience with $100 million war chest,https://www.tbstat.com/wp/uploads/2021/08/20210819_TheScoop_Devin_Finzer_16x9-edit-800x450.jpg,https://coinmarketcal.com/en/news/nft-unicorn-opensea-sets-sights-on-improving-customer-experience-with-100-million-war-chest,23-Aug-21,8/23/2021 0:00
1483,Mapping out Binance Labs Portfolio,https://www.tbstat.com/wp/uploads/2021/07/20210729_Binance-Labs-Map-Research-800x450.jpg,https://coinmarketcal.com/en/news/mapping-out-binance-labs-portfolio,23-Aug-21,8/23/2021 0:00
1484,USDC reserves will be reversed to cash and US treasuries only,https://www.tbstat.com/wp/uploads/2020/05/20200505_USDC-Daily-800x450.jpg,https://coinmarketcal.com/en/news/usdc-reserves-will-be-reversed-to-cash-and-us-treasuries-only,23-Aug-21,8/23/2021 0:00
1485,Binance Singapore hires former SGX chief regulatory officer as CEO,https://www.tbstat.com/wp/uploads/2021/07/20210720_Binance_generic_1-800x450.jpg,https://coinmarketcal.com/en/news/binance-singapore-hires-former-sgx-chief-regulatory-officer-as-ceo,23-Aug-21,8/23/2021 0:00
1486,"Bitcoin price breaks above $50,000 for first time in 100 days",https://www.tbstat.com/wp/uploads/2021/06/20210601_Bitcoin_Generic-800x450.jpg,https://coinmarketcal.com/en/news/bitcoin-price-breaks-above-50-000-for-first-time-in-100-days,23-Aug-21,8/23/2021 0:00
1487,PayPal launches crypto trading service in the UK,https://www.tbstat.com/wp/uploads/2021/08/paypal-675x450.jpeg,https://coinmarketcal.com/en/news/paypal-launches-crypto-trading-service-in-the-uk,23-Aug-21,8/23/2021 0:00
1488,3 coins to keep an eye on | Issue #144,https://bucket.mlcdn.com/a/1227/1227214/images/b12dc658836e57920f380e64615c4061b0a7814b.png,https://coinmarketcal.com/en/news/3-coins-to-keep-an-eye-on-issue-144,23-Aug-21,8/23/2021 0:00
1489,OpenSea is first NFT marketplace to pass $1 billion in monthly trading volume ,https://www.tbstat.com/wp/uploads/2021/05/20210513_NFT_Generic_P-800x450.jpg,https://coinmarketcal.com/en/news/opensea-is-first-nft-marketplace-to-pass-1-billion-in-monthly-trading-volume,22-Aug-21,8/22/2021 0:00
1490,Wall Street charity bike ride draws a bigger crypto crowd this year,https://www.tbstat.com/wp/uploads/2021/08/20210820_Bike-Race-Autism-Science-logo-800x450.jpg,https://coinmarketcal.com/en/news/wall-street-charity-bike-ride-draws-a-bigger-crypto-crowd-this-year,21-Aug-21,8/21/2021 0:00
1491,Squiggles maker Art Blocks ‘can’t keep art live on the platform’ amid NFT frenzy,https://www.tbstat.com/wp/uploads/2021/08/20210818_Artblocks_Squiggle-800x450.jpg,https://coinmarketcal.com/en/news/squiggles-maker-art-blocks-cant-keep-art-live-on-the-platform-amid-nft-frenzy,21-Aug-21,8/21/2021 0:00
1492,A lack of precedent leads Swedish court to return 33 BTC after law enforcement seizure,https://www.tbstat.com/wp/uploads/2020/02/shutterstock_147361679-675x450.jpg,https://coinmarketcal.com/en/news/a-lack-of-precedent-leads-swedish-court-to-return-33-btc-after-law-enforcement-seizure,20-Aug-21,8/20/2021 0:00
1493,Two issuers withdraw SEC submissions for an ETH ETF,https://www.tbstat.com/wp/uploads/2021/06/20210628_SEC_logo-800x450.jpg,https://coinmarketcal.com/en/news/two-issuers-withdraw-sec-submissions-for-an-eth-etf,20-Aug-21,8/20/2021 0:00
1494,Mapping out North America’s crypto mining infrastructure boom,https://www.tbstat.com/wp/uploads/2020/11/20201117_Mining-Daily-800x450.jpg,https://coinmarketcal.com/en/news/mapping-out-north-americas-crypto-mining-infrastructure-boom,20-Aug-21,8/20/2021 0:00
1495,SEC wins $12 million judgment against BitConnect representative,https://www.tbstat.com/wp/uploads/2019/06/sec-filter-2-800x450.jpg,https://coinmarketcal.com/en/news/sec-wins-12-million-judgment-against-bitconnect-representative,20-Aug-21,8/20/2021 0:00
1496,Binance enforces mandatory KYC on all users amid mounting regulatory pressure,https://www.tbstat.com/wp/uploads/2021/01/20210105_CZ-Daily-800x450.png,https://coinmarketcal.com/en/news/binance-enforces-mandatory-kyc-on-all-users-amid-mounting-regulatory-pressure,20-Aug-21,8/20/2021 0:00
1497,BinanceUS wants to raise $100 million but investors are wary due to regulatory concerns,https://www.tbstat.com/wp/uploads/2021/04/20210426_Brian-Brooks-Binance-US-800x450.jpg,https://coinmarketcal.com/en/news/binanceus-wants-to-raise-100-million-but-investors-are-wary-due-to-regulatory-concerns,19-Aug-21,8/19/2021 0:00
1498,"Wells Fargo, JPMorgan partner with NYDIG to launch bitcoin funds",https://www.tbstat.com/wp/uploads/2021/07/20210714_NYDIG-800x450.jpg,https://coinmarketcal.com/en/news/wells-fargo-jpmorgan-partner-with-nydig-to-launch-bitcoin-funds,19-Aug-21,8/19/2021 0:00
1499,"Brian Quintenz, crypto-friendly CFTC commissioner, to leave office at end of August",https://www.tbstat.com/wp/uploads/2020/04/CFTC-675x450.jpg,https://coinmarketcal.com/en/news/brian-quintenz-crypto-friendly-cftc-commissioner-to-leave-office-at-end-of-august,19-Aug-21,8/19/2021 0:00
1500,1confirmation backs new NFT startup built for music artists in $2.2 million round,https://www.tbstat.com/wp/uploads/2019/03/music-listening-800x450.jpg,https://coinmarketcal.com/en/news/1confirmation-backs-new-nft-startup-built-for-music-artists-in-2-2-million-round,19-Aug-21,8/19/2021 0:00
1501,FinTech Collective closes $250 million fund with new DeFi strategy,https://www.tbstat.com/wp/uploads/2021/05/2021-517_VC_Invest_DeFI-800x450.png,https://coinmarketcal.com/en/news/fintech-collective-closes-250-million-fund-with-new-defi-strategy,19-Aug-21,8/19/2021 0:00
1502,Coinbase CFO says the firm has stockpiled billions to prepare for ‘crypto winter’: report,https://www.tbstat.com/wp/uploads/2021/04/20210414_Alesia_Haas_Coinbase-800x450.jpg,https://coinmarketcal.com/en/news/coinbase-cfo-says-the-firm-has-stockpiled-billions-to-prepare-for-crypto-winter-report,19-Aug-21,8/19/2021 0:00
1503,Robinhood stock price whipsaws downward after disappointing Q2 earnings report,https://www.tbstat.com/wp/uploads/2021/08/20210803_Robinhood_Crypto-800x450.jpg,https://coinmarketcal.com/en/news/robinhood-stock-price-whipsaws-downward-after-disappointing-q2-earnings-report,19-Aug-21,8/19/2021 0:00
1504,Bloomberg and Galaxy team up on decentralized finance index,https://www.tbstat.com/wp/uploads/2020/04/020420-GalaxyDigital-800x450.jpg,https://coinmarketcal.com/en/news/bloomberg-and-galaxy-team-up-on-decentralized-finance-index,19-Aug-21,8/19/2021 0:00
1505,Former SEC chair Clayton joins Fireblocks advisory board,https://www.tbstat.com/wp/uploads/2020/11/20201116_Jay-Clayton-SEC-800x450.jpg,https://coinmarketcal.com/en/news/former-sec-chair-clayton-joins-fireblocks-advisory-board,19-Aug-21,8/19/2021 0:00
1506,"ParaFi, Dragonfly back new investment venture aimed at Web3 and APAC",https://www.tbstat.com/wp/uploads/2020/07/20200707_Investment-Daily-800x450.jpg,https://coinmarketcal.com/en/news/parafi-dragonfly-back-new-investment-venture-aimed-at-web3-and-apac,19-Aug-21,8/19/2021 0:00
1507,"DeFi projects could come under SEC’s oversight, says chairman Gensler",https://www.tbstat.com/wp/uploads/2021/06/20210628_Gary_Gensler-800x450.jpg,https://coinmarketcal.com/en/news/defi-projects-could-come-under-secs-oversight-says-chairman-gensler,19-Aug-21,8/19/2021 0:00
1508,"Japanese exchange Liquid hacked, hacker in possession of $74 million in crypto assets",https://www.tbstat.com/wp/uploads/2021/05/20210517_Hack_Generic_3-800x450.png,https://coinmarketcal.com/en/news/japanese-exchange-liquid-hacked-hacker-in-possession-of-74-million-in-crypto-assets,19-Aug-21,8/19/2021 0:00
1509,Coinbase is launching crypto exchange in Japan with financial giant Mitsubishi UFJ,https://www.tbstat.com/wp/uploads/2021/04/20210416_Coinbase_Generic_Stocks-800x450.jpg,https://coinmarketcal.com/en/news/coinbase-is-launching-crypto-exchange-in-japan-with-financial-giant-mitsubishi-ufj,19-Aug-21,8/19/2021 0:00
1510,DAVID ORBAN joins HYVE Advisory Board,https://coinmarketcal-share.s3.eu-west-1.amazonaws.com/News/photo_2021-08-19+12.27.23.jpeg,https://coinmarketcal.com/en/news/david-orban-joins-hyve-advisory-board,19-Aug-21,8/19/2021 0:00
1511,Should You Sell Your Bitcoin?,https://coinmarketcal-share.s3.eu-west-1.amazonaws.com/News/photo_2021-08-20+09.36.21.jpeg,https://coinmarketcal.com/en/news/should-you-sell-your-bitcoin,19-Aug-21,8/19/2021 0:00
1512,3 Ways to Add Crypto Payments to Your Website,https://coinmarketcal-share.s3.eu-west-1.amazonaws.com/News/photo_2021-08-20+09.37.09.jpeg,https://coinmarketcal.com/en/news/3-ways-to-add-crypto-payments-to-your-website,19-Aug-21,8/19/2021 0:00
1513,Is it Worth Buying Bitcoin in 2021?,https://coinmarketcal-share.s3.eu-west-1.amazonaws.com/News/photo_2021-08-20+09.37.08.jpeg,https://coinmarketcal.com/en/news/is-it-worth-buying-bitcoin-in-2021,19-Aug-21,8/19/2021 0:00
1514,Best New Cryptocurrencies in the Market,https://coinmarketcal-share.s3.eu-west-1.amazonaws.com/News/photo_2021-08-20+09.36.22.jpeg,https://coinmarketcal.com/en/news/best-new-cryptocurrencies-in-the-market,19-Aug-21,8/19/2021 0:00
1515,Operator of bitcoin mixing service Helix pleads guilty to laundering more than $300 million,https://www.tbstat.com/wp/uploads/2020/12/20201207_Mixers_c-Daily-800x450.png,https://coinmarketcal.com/en/news/operator-of-bitcoin-mixing-service-helix-pleads-guilty-to-laundering-more-than-300-million,18-Aug-21,8/18/2021 0:00
1516,Crypto payments project MobileCoin raises $66 million in Series B funding,https://www.tbstat.com/wp/uploads/2021/04/20210402_Funding_Generic-800x450.jpg,https://coinmarketcal.com/en/news/crypto-payments-project-mobilecoin-raises-66-million-in-series-b-funding,18-Aug-21,8/18/2021 0:00
1517,Crypto grows from 2% to 41% of Robinhood’s total revenue in past year,https://www.tbstat.com/wp/uploads/2021/08/20210803_Robinhood_Crypto-800x450.jpg,https://coinmarketcal.com/en/news/crypto-grows-from-2-to-41-of-robinhoods-total-revenue-in-past-year,18-Aug-21,8/18/2021 0:00
1518,Binance says it will seek registration in the Netherlands as country’s central bank issues warning,https://www.tbstat.com/wp/uploads/2021/07/20210720_Binance_generic_2-800x450.jpg,https://coinmarketcal.com/en/news/binance-says-it-will-seek-registration-in-the-netherlands-as-countrys-central-bank-issues-warning,18-Aug-21,8/18/2021 0:00
1519,Multi-billion dollar hedge funds are tapping into DeFi with MetaMask’s institutional product,https://www.tbstat.com/wp/uploads/2021/08/20210818_TheScoop_Johann_Bornman_16x9-800x450.jpg,https://coinmarketcal.com/en/news/multi-billion-dollar-hedge-funds-are-tapping-into-defi-with-metamasks-institutional-product,18-Aug-21,8/18/2021 0:00
1520,Avalanche launches $180 million DeFi incentive scheme with Aave and Curve,https://www.tbstat.com/wp/uploads/2020/05/20200511_AVA_Growth-800x450.jpg,https://coinmarketcal.com/en/news/avalanche-launches-180-million-defi-incentive-scheme-with-aave-and-curve,18-Aug-21,8/18/2021 0:00
1521,Former Payza CEO convicted of money laundering is suing Blockchain.com over blocked bitcoin transfer,https://www.tbstat.com/wp/uploads/2019/01/courtroom-1-800x450.jpg,https://coinmarketcal.com/en/news/former-payza-ceo-convicted-of-money-laundering-is-suing-blockchain-com-over-blocked-bitcoin-transfer,18-Aug-21,8/18/2021 0:00
1522,Binance hires former IRS official for money laundering reporting role,https://www.tbstat.com/wp/uploads/2021/07/shutterstock_1926147116-ai-800x450.jpg,https://coinmarketcal.com/en/news/binance-hires-former-irs-official-for-money-laundering-reporting-role,18-Aug-21,8/18/2021 0:00
1523,Bitcoin mining firm Iris Energy files to go public via direct listing on Nasdaq,https://www.tbstat.com/wp/uploads/2021/03/20210318_Mining_Stocks-800x450.jpg,https://coinmarketcal.com/en/news/bitcoin-mining-firm-iris-energy-files-to-go-public-via-direct-listing-on-nasdaq,18-Aug-21,8/18/2021 0:00
1524,1 Billion People to Crypto Market? & Huge APR/APY how?,https://coinmarketcal-share.s3.eu-west-1.amazonaws.com/News/1_cHWad5x49-FNFk8SKJDHVA.png,https://coinmarketcal.com/en/news/1-billion-people-to-crypto-market-huge-apr-apy-how,18-Aug-21,8/18/2021 0:00
1525,Galaxy reports losing $175 million during the last quarter in recent earnings call,https://www.tbstat.com/wp/uploads/2020/04/020420-GalaxyDigital-800x450.jpg,https://coinmarketcal.com/en/news/galaxy-reports-losing-175-million-during-the-last-quarter-in-recent-earnings-call,17-Aug-21,8/17/2021 0:00
1526,Google search volume for NFT marketplace OpenSea reached an all-time high last week,https://www.tbstat.com/wp/uploads/2021/05/20210513_NFT_Generic_M-800x450.jpg,https://coinmarketcal.com/en/news/google-search-volume-for-nft-marketplace-opensea-reached-an-all-time-high-last-week,17-Aug-21,8/17/2021 0:00
1527,Galaxy files for ETF that provides indirect exposure to bitcoin,https://www.tbstat.com/wp/uploads/2020/06/20200630_Galaxy_Digital_-Daily-800x450.jpg,https://coinmarketcal.com/en/news/galaxy-files-for-etf-that-provides-indirect-exposure-to-bitcoin,17-Aug-21,8/17/2021 0:00
1528,Leading advocates in Congress re-introduce Blockchain Regulatory Certainty Act,https://www.tbstat.com/wp/uploads/2021/08/shutterstock_634024823-675x450.jpg,https://coinmarketcal.com/en/news/leading-advocates-in-congress-re-introduce-blockchain-regulatory-certainty-act,17-Aug-21,8/17/2021 0:00
1529,DEX aggregator 1inch expands to Ethereum scaling solution Optimism,https://www.tbstat.com/wp/uploads/2020/12/20201202_1inch-Daily-800x450.png,https://coinmarketcal.com/en/news/dex-aggregator-1inch-expands-to-ethereum-scaling-solution-optimism,17-Aug-21,8/17/2021 0:00
1530,Former Goldman Sachs employees launch DeFi protocol Ondo with $4 million in seed funding ,https://www.tbstat.com/wp/uploads/2021/08/ondo-800x337.png,https://coinmarketcal.com/en/news/former-goldman-sachs-employees-launch-defi-protocol-ondo-with-4-million-in-seed-funding,17-Aug-21,8/17/2021 0:00
1531,Blockchain security firm CertiK raises another $24 million one month after its Series B,https://www.tbstat.com/wp/uploads/2021/07/20210713_Certik_Funding-800x450.jpg,https://coinmarketcal.com/en/news/blockchain-security-firm-certik-raises-another-24-million-one-month-after-its-series-b,17-Aug-21,8/17/2021 0:00
1532,Austrian crypto unicorn Bitpanda raises another $263 million,https://www.tbstat.com/wp/uploads/2018/12/peter-thiel-2-getty-800x450.jpg,https://coinmarketcal.com/en/news/austrian-crypto-unicorn-bitpanda-raises-another-263-million,17-Aug-21,8/17/2021 0:00
1533,BinanceUS picks CFO to helm exchange after abrupt Brian Brooks exit,https://www.tbstat.com/wp/uploads/2021/07/20210720_Binance_generic_2-800x450.jpg,https://coinmarketcal.com/en/news/binanceus-picks-cfo-to-helm-exchange-after-abrupt-brian-brooks-exit,17-Aug-21,8/17/2021 0:00
1534,Biden reportedly set to nominate acting CFTC chair Rostin Behnam as official agency lead,https://www.tbstat.com/wp/uploads/2021/04/20210402_Cybercrime_Generic_G-800x450.jpg,https://coinmarketcal.com/en/news/biden-reportedly-set-to-nominate-acting-cftc-chair-rostin-behnam-as-official-agency-lead,17-Aug-21,8/17/2021 0:00
1535,Solana hits all-time high as market watchers say institutional interest is growing,https://www.tbstat.com/wp/uploads/2021/05/20210527_Solana_Generic_2-800x450.jpg,https://coinmarketcal.com/en/news/solana-hits-all-time-high-as-market-watchers-say-institutional-interest-is-growing,16-Aug-21,8/16/2021 0:00
1536,Twitter taps crypto developer to lead decentralized social media initiative Bluesky,https://www.tbstat.com/wp/uploads/2021/07/20210707_Twitter_NFT-800x450.jpg,https://coinmarketcal.com/en/news/twitter-taps-crypto-developer-to-lead-decentralized-social-media-initiative-bluesky,16-Aug-21,8/16/2021 0:00
1537,Crypto staking firm Figment raises $50 million in Series B funding round,https://www.tbstat.com/wp/uploads/2021/04/20210402_Funding_Generic_A-800x450.jpg,https://coinmarketcal.com/en/news/crypto-staking-firm-figment-raises-50-million-in-series-b-funding-round,16-Aug-21,8/16/2021 0:00
1538,Dark web blockchain analysis tool suspended after flurry of media coverage,https://www.tbstat.com/wp/uploads/2019/07/hacker-dark-web-hacking-800x450.jpg,https://coinmarketcal.com/en/news/dark-web-blockchain-analysis-tool-suspended-after-flurry-of-media-coverage,16-Aug-21,8/16/2021 0:00
1539,Mawson to expand bitcoin mining capacity by 300 MW in Georgia state,https://www.tbstat.com/wp/uploads/2021/02/20210216_Mining_Bitcoin_Generic-800x450.jpg,https://coinmarketcal.com/en/news/mawson-to-expand-bitcoin-mining-capacity-by-300-mw-in-georgia-state,16-Aug-21,8/16/2021 0:00
1540,Walmart is looking for a crypto product lead,https://www.tbstat.com/wp/uploads/2019/08/walmart-2-800x450.jpg,https://coinmarketcal.com/en/news/walmart-is-looking-for-a-crypto-product-lead,16-Aug-21,8/16/2021 0:00
1541,Only 1 Token - Portfolio Tracker Updates,https://coinmarketcal-share.s3.eu-west-1.amazonaws.com/News/1_U1ljgzMPiSHv2rCsYcT2qw.jpeg,https://coinmarketcal.com/en/news/only-1-token-portfolio-tracker-updates,16-Aug-21,8/16/2021 0:00
1542,3 coins to keep an eye on | Issue #143,https://bucket.mlcdn.com/a/1227/1227214/images/74e0bd6ae102d25e2f416014c8dbdb1987393a39.png,https://coinmarketcal.com/en/news/3-coins-to-keep-an-eye-on-issue-143,16-Aug-21,8/16/2021 0:00
1543,CoinFund hires former Citigroup exec as new president and managing partner,https://www.tbstat.com/wp/uploads/2021/06/20210616_Crypto-Hiring-800x450.jpg,https://coinmarketcal.com/en/news/coinfund-hires-former-citigroup-exec-as-new-president-and-managing-partner,13-Aug-21,8/13/2021 0:00
1544,"Fintech firm Chime raises $750 million, scores $25 billion valuation",https://www.tbstat.com/wp/uploads/2021/04/20210402_Funding_Generic-800x450.jpg,https://coinmarketcal.com/en/news/fintech-firm-chime-raises-750-million-scores-25-billion-valuation,13-Aug-21,8/13/2021 0:00
1545,How do Ethereum transaction fees work now that EIP-1559 is live?,https://www.tbstat.com/wp/uploads/2021/08/20210812_Ethereum_Transaction_Fees-797x450.jpg,https://coinmarketcal.com/en/news/how-do-ethereum-transaction-fees-work-now-that-eip-1559-is-live,13-Aug-21,8/13/2021 0:00
1546,Binance to trace crypto hacked from user account following UK court order,https://www.tbstat.com/wp/uploads/2019/06/court-columns-800x450.jpg,https://coinmarketcal.com/en/news/binance-to-trace-crypto-hacked-from-user-account-following-uk-court-order,13-Aug-21,8/13/2021 0:00
1547,Polygon acquires Hermez in $250 million deal that includes first-ever token ‘merger’,https://www.tbstat.com/wp/uploads/2021/08/20210813_Hermez_Polygon_M-800x450.jpg,https://coinmarketcal.com/en/news/polygon-acquires-hermez-in-250-million-deal-that-includes-first-ever-token-merger,13-Aug-21,8/13/2021 0:00
1548,Kryptoin files with the SEC to create an ETH ETF,https://www.tbstat.com/wp/uploads/2021/04/20210409_Ethereum_Generic_s-800x450.jpg,https://coinmarketcal.com/en/news/kryptoin-files-with-the-sec-to-create-an-eth-etf,12-Aug-21,8/12/2021 0:00
1549,Poly Network hacker returns nearly all of the $611 million in stolen funds,https://www.tbstat.com/wp/uploads/2021/03/20210305_Hacking_Defi_2-800x450.png,https://coinmarketcal.com/en/news/poly-network-hacker-returns-nearly-all-of-the-611-million-in-stolen-funds,12-Aug-21,8/12/2021 0:00
1550,US Immigration and Customs Enforcement plans to use Coinbase forensics tools,https://www.tbstat.com/wp/uploads/2021/02/20210225_Coinbase_Gen-4-800x450.jpg,https://coinmarketcal.com/en/news/us-immigration-and-customs-enforcement-plans-to-use-coinbase-forensics-tools,12-Aug-21,8/12/2021 0:00
1551,Crypto startup TaxBit is now valued at $1.33 billion after new $130 million funding round,https://www.tbstat.com/wp/uploads/2021/08/20210811_Taxbit_Unicorn-800x450.png,https://coinmarketcal.com/en/news/crypto-startup-taxbit-is-now-valued-at-1-33-billion-after-new-130-million-funding-round,12-Aug-21,8/12/2021 0:00
1552,Crypto data analytics platform Dune raises $8 million in Series A funding,https://www.tbstat.com/wp/uploads/2021/08/20210811_Dune_Analytics_funding-800x450.png,https://coinmarketcal.com/en/news/crypto-data-analytics-platform-dune-raises-8-million-in-series-a-funding,12-Aug-21,8/12/2021 0:00
1553,Ethereum network burns $100 million of ETH in first week after London upgrade,https://www.tbstat.com/wp/uploads/2021/08/Webp.net-resizeimage4-800x450.jpg,https://coinmarketcal.com/en/news/ethereum-network-burns-100-million-of-eth-in-first-week-after-london-upgrade,12-Aug-21,8/12/2021 0:00
1554,Messi receives ‘large number’ of crypto fan tokens as part of his PSG package,https://www.tbstat.com/wp/uploads/2020/02/shutterstock_1552252883-674x450.jpg,https://coinmarketcal.com/en/news/messi-receives-large-number-of-crypto-fan-tokens-as-part-of-his-psg-package,12-Aug-21,8/12/2021 0:00
1555,Institutional clients are pushing NYDIG and Fidelity to offer more ETH services,https://www.tbstat.com/wp/uploads/2021/07/20210709_ETH_Time_Bandits-800x450.jpg,https://coinmarketcal.com/en/news/institutional-clients-are-pushing-nydig-and-fidelity-to-offer-more-eth-services,11-Aug-21,8/11/2021 0:00
